tt0164393|Berserker|2004|Horror|Six young adults in the woods run afoul of a berserker, a viking warrior who dons the fur and snout of a bear, and are slain in turn by him.|Joseph Alan Johnson, Greg Dawson, Valerie Sheldon, Shannon Engemann|1|0|Ended
tt0300922|All Babes Want To Kill Me|2005|Comedy, Romance|A Martial Artist, afflicted with a disease that makes beautiful women want to kill him, goes on a suicide mission to find true love anyway.|Colin Miller, Gianni Lazuli, Alex Cain, John F. Schaffer|1|0|Ended
tt1603314|Killjoy 3|2010|Horror|The demon clown Killjoy is resurrected once again, but this time he is not given the name of his victim and is trapped in his realm. Using a magic mirror he lures four unsuspecting college ...|Trent Haaga, Victoria De Mare, Al Burke, Tai Chan Ngo|1|0|Ended
tt0790781|Wendy Wu: Homecoming Warrior|2006|Action, Adventure, Family|A Californian teenager learns that she is the reincarnation of a legendary female warrior destined to protect the world.|Brenda Song, Shin Koyamada, Susan Chuang, Justin Chon|1|0|Ended
tt1388402|Bad Day to Go Fishing|2009|Comedy, Drama, Western|"Jacob van Oppen, the former strongest man on earth, and his manager Orsini, who calls himself ""the Prince"", make a good living by traveling around small South American towns and organizing ..."|Gary Piquer, Jouko Ahola, Antonella Costa, César Troncoso|1|0|Ended
tt0495026|Choose Connor|2007|Drama|Idealistic 15-year old Owen gets the chance of a lifetime to be the youth spokesman for U.S. Senate Candidate Lawrence Connor, only to be exploited in a fierce campaign of TV and radio ads,...|Darin Cooper, Chris Marquette, Alex D. Linz, James Runcorn|1|0|Ended
tt0066093|Monte Walsh|2003|Western|An aging cowboy realizes that the West he knew and loved will soon be no more--and that there will be no room for him, either.|Lee Marvin, Jeanne Moreau, Jack Palance, Mitchell Ryan|1|0|Ended
tt0048199|Illegal|2010|Crime, Drama, Film-Noir|After an overly aggressive district attorney unknowingly sends an innocent man to the chair, he resigns, turns to drinking, and acquires a criminal clientèle.|Edward G. Robinson, Nina Foch, Hugh Marlowe, Jayne Mansfield|1|0|Ended
tt0094889|Cocktail|2006|Comedy, Drama, Romance|A talented New York City bartender takes a job at a bar in Jamaica and falls in love.|Tom Cruise, Bryan Brown, Elisabeth Shue, Lisa Banes|1|0|Ended
tt1477859|A Good Rain Knows|2009|Drama, Romance|A traveling architect meets an old friend from his student years; the pair realize their connection has always been a romantic one.|Woo-sung Jung, Yuanyuan Gao, Sang-ho Kim, Shaohua Ma|1|0|Ended
tt1236410|Cobalt Blue|2009|Drama|A drama centered on a young woman who heads to her father s home in Okinawa to try and cope with her boyfriend s death.|Masami Nagasawa, Seiji Fukushi, Kuranosuke Sasaki, Shinji Rachi|1|0|Ended
tt1456520|All s Well Ends Well 2010|2010|Comedy|N/A|Louis Koo, Sandra Kwan Yue Ng, Ronald Cheng, Yueming Pan|1|0|Ended
tt2200404|Strikeforce: Diaz vs. Daley|2011|Sport|N/A|Brett Albee, Shinya Aoki, Saad Awad, Lyle Beerbohm|1|0|Ended
tt1046171|You and I|2011|Drama, Romance, Thriller|Two teenage girls, Janie who is American and Lana who is Russian, fall in love after meeting at a t.A.T.u concert and are swept into a dangerous world of obsession, drug abuse and murder.|Mischa Barton, Shantel VanSanten, Anton Yelchin, Alex Kaluzhsky|1|0|Ended
tt1501343|Cinematic Titanic: Blood of the Vampires|2009|Comedy|The Escodero family is cursed! The mother is actually an undead vampire who lurks in a secret basement/dungeon hidden from the rest of the house. When the kids discover this dark truth, all...|Trace Beaulieu, Frank Conniff, Joel Hodgson, Mary Jo Pehl|1|0|Ended
tt0838164|Done the Impossible|2006|Documentary|Firefly and Serenity have grown beyond the genius of Joss Whedon. The words Firefly and Browncoat have come to symbolize a sense of community, family, and believing that the impossible can ...|Morena Baccarin, Kevin Bachelder, Adam Baldwin, Michael Boretz|1|0|Ended
tt0293854|The Little Bear Movie|2001|Animation, Adventure, Family|Little Bear and Father Bear are camping in the woods when they meet a smaller bear named Cub. It seems that Cub became separated from his parents during a storm and now he can t find them. ...|Kristin Fairlie, Dan Hennessey, Janet-Laine Green, Max Morrow|1|0|Ended
tt0403910|Bush s Brain|2004|Documentary|An examination of political consultant Karl Rove s influence on George W. Bush s candidacy.|Cathy Bonner, Bruce Buchanan, Max Cleland, Shirley Cuff|1|0|Ended
tt0203540|Greenfingers|2001|Comedy, Crime, Romance|A prison inmate with a green thumb goes on to compete in a national gardening competition. Based on a true story.|Clive Owen, Helen Mirren, David Kelly, Warren Clarke|1|0|Ended
tt1471247|Road to Sangam|2010|Drama, Thriller|Amidst bomb explosions, fake arrests, police brutality and protests, a determined mechanic attempts to repair an antique truck to transport the last remains of Mahatma Gandhi in modern day India.|Paresh Rawal, Om Puri, Pavan Malhotra, Javed Sheikh|1|0|Ended
tt1582539|Maa Nanna Chiranjeevi|2010|Family|A father whose wife has left him because of poverty she created, takes his son to Hyderabad and struggles to find a way to support the two of them and pay for the son s education.|Jagapathi Babu, Ali, Alutit, Brahmanandam|1|0|Ended
tt1592525|Lockout|2006|Action, Adventure, Sci-Fi|A man wrongly convicted of conspiracy to commit espionage against the U.S. is offered his freedom if he can rescue the president s daughter from an outer space prison taken over by violent inmates.|Guy Pearce, Maggie Grace, Vincent Regan, Joseph Gilgun|1|0|Ended
tt1290417|Retardead|2008|Comedy, Horror|The evil Dr. Stern returns, armed with a lethal intelligence serum that yields horrific results at the Butte County Institute for Special Education.|Rick Popko, Tony Adams, Michael Allen, Shamika Baker|1|0|Ended
tt1900940|Night of the Groping Dead|2001|Horror|"After discovering that Misty has a magic stone called the ""The Crack of Dawn"", Queen Zombie Ruby sends her army of zombies to get it, get her, grope her and turn her into a zombie too."|Erin Brown, Marcus Desade, Chris Emerle, Rich Hillen|1|0|Ended
tt1994588|The Wiggles: Let s Eat|2011|Family|N/A|Murray Cook, Jeff Fatt, Anthony Field, Sam Moran|1|0|Ended
tt1618430|Dum Maaro Dum|2011|Action, Crime, Drama|N/A|Abhishek Bachchan, Bipasha Basu, Rana Daggubati, Prateik|1|0|Ended
tt0788006|Assume the Position with Mr. Wuhl|2007|Documentary, Short, Comedy|Actor Robert Wuhl examines facts and myths in American history.|Robert Wuhl, Elliott Brooke, Tucker Carlson, David Cross|1|0|Ended
tt0954947|The Killer Inside Me|2010|Crime, Drama, Thriller|A West Texas deputy sheriff is slowly unmasked as a psychotic killer.|Casey Affleck, Kate Hudson, Jessica Alba, Ned Beatty|1|0|Ended
tt0423853|Be Here to Love Me: A Film About Townes Van Zandt|2004|Documentary, Biography, Music|Be Here to Love Me - Chronicles the fascinating and often turbulent life of Townes Van Zandt.|Joe Ely, Guy Clark, Willie Nelson, Kris Kristofferson|1|0|Ended
tt1297389|Güneşin Oğlu|2008|Comedy, Fantasy|N/A|Haluk Bilginer, Özgü Namal, Köksal Engür, Bülent Emin Yarar|1|0|Ended
tt0271793|La sociologie est un sport de combat|2001|Documentary|Introduction to Sociology. For three years (1998-2001) Pierre Carles followed Pierre Bourdieu, a major sociologist, working to have his research understood and people prompted to action. ...|Pierre Bourdieu, José Bové, Pierre Carles, Gaby Reich|1|0|Ended
tt0488400|What s a Human Anyway?|2006|Comedy|In an apartment building where neighbors, friends, and family are living in close quarters, three male protagonists encounter three phases of manhood in Turkish society. Directors Reha ...|Turgay Aydin, Arzu Bazman, Ali Düsenkalkar, Köksal Engür|1|0|Ended
tt1039651|Yona Yona Penguin|2009|Animation, Adventure, Family|An animated adventure about three children who travel to a fantasy land.|Féodor Atkine, Rica Matsumoto, Yves Barsacq, Jeanne Savary|1|0|Ended
tt1523402|Adını Sen Koy|2010|Drama|N/A|Melis Birkan, Cemal Toktas, Ahmet Mümtaz Taylan, Ali Il|1|0|Ended
tt0232884|Vali|2009|Documentary|N/A|Vali Myers, Rudi Rappold|1|0|Ended
tt0082198|Conan the Barbarian|2011|Adventure, Fantasy|A vengeful barbarian warrior sets off to avenge his tribe and his parents whom were slain by an evil sorcerer and his warriors when he was a boy.|Arnold Schwarzenegger, James Earl Jones, Max von Sydow, Sandahl Bergman|1|0|Ended
tt1380152|Marine Boy|2009|Action, Thriller|A swim instructor loses everything he has and is offered a debt free life if he smuggles drugs into the country by swimming underwater.|Kang-woo Kim, Jae-hyeon Jo, Si-Yeon Park, Won-jong Lee|1|0|Ended
tt0481630|SuicideGirls: The First Tour|2005|Documentary|What Playboy magazine was to the 1950 s, SuicideGirls is to the new millennium: a revolutionary lifestyle brand that combines the DIY attitude of underground culture with a vibrant, ...|Raven Isis, Pearl, Reagan, London Suicide|1|0|Ended
tt0308508|Step Into Liquid|2003|Documentary, Sport|Surfers and secret spots from around the world are profiled in this documentary.|Robert August, Rochelle Ballard, Shawn Barron, Layne Beachley|1|0|Ended
tt0426615|In The Mix|2005|Comedy, Crime, Drama|A successful DJ manages to rescue a powerful mobster one night. In order to repay him, the mobster gives him the task of protecting his daughter.|Usher Raymond, Chazz Palminteri, Emmanuelle Chriqui, Robert Costanzo|1|0|Ended
tt0479948|Living & Dying|2007|Action, Crime, Thriller|Two killers turn the tables on a trio of robbers when they find themselves in a hostage situation. Surrounded by the police, the robbers must become the heroes before the killers execute everyone.|Tom Zembrod, Edward Furlong, Michael Madsen, Bai Ling|1|0|Ended
tt0102011|He Said, She Said|2009|Comedy, Drama, Romance|Dan and Lorie are journalists working in the same office. More often than not they have opposing view of the issue in question. Deciding that this is hot stuff, a television producer gives ...|Kevin Bacon, Elizabeth Perkins, Nathan Lane, Anthony LaPaglia|1|0|Ended
tt1643222|Hell|2005|Horror, Sci-Fi, Thriller|In the not too distant future, people struggle to survive their greatest enemy, the sun.|Lilo Baur, Marco Calamandrei, Lisa Vicari, Lars Eidinger|1|0|Ended
tt0342965|Gone Nutty|2002|Animation, Short, Adventure|Scrat is putting one last acorn into a huge and very neatly arranged stash, but it keeps popping up. He jumps on it -- once too often, and the whole stockpile falls through a knothole in ...|Chris Wedge|1|0|Ended
tt0853087|Ben Folds and Waso Live in Perth|2005|Music|N/A|N/A|1|0|Ended
tt1067106|A Christmas Carol|2009|Animation, Drama, Family|An animated retelling of Charles Dickens  classic novel about a Victorian-era miser taken on a journey of self-redemption, courtesy of several mysterious Christmas apparitions.|Jim Carrey, Steve Valentine, Daryl Sabara, Sage Ryan|1|0|Ended
tt1515837|Jonatan Spangs familie|2008|Comedy|N/A|Jonatan Spang|1|0|Ended
tt0337996|DysFunktional Family|2003|Comedy, Documentary|Documentary on comedian Eddie Griffin who heads back home to a family reunion, which includes two uncles - one a porn director and the other an ex-pimp.|Eddie Griffin, Joe Howard, Matthew Brent, Robert Noble|1|0|Ended
tt1266583|Mumbai Meri Jaan|2008|Drama|Five people whose lives are affected by the 2006 Mumbai train bombings.|Paresh Rawal, Kay Kay Menon, Irrfan Khan, Madhavan|1|0|Ended
tt1155056|I Love You, Man|2009|Comedy, Romance|Friendless Peter Klaven goes on a series of man-dates to find a Best Man for his wedding. But, when his insta-bond with his new B.F.F. puts a strain on his relationship with his fiancée, can the trio learn to live happily ever after?|Paul Rudd, Rashida Jones, Sarah Burns, Greg Levine|1|0|Ended
tt0245157|Zus & zo|2001|Comedy, Fantasy, Romance|Zus & Zo shows what three sisters are willing to do to stop their would-be sister-in-law from coming into possession of Paraíso, their beloved family summer home on the Portuguese coast.|Sylvia Poorta, Anneke Blok, Monic Hendrickx, Jacob Derwig|1|0|Ended
tt0196186|I Vicerè|2007|Drama, History|Story in set in Sicily, 1800. The Uzeda family fights to remain in control of its power against the new regime, both on political and personal side, leading to intricate love affairs, ...|Alessandro Preziosi, Lando Buzzanca, Cristiana Capotondi, Guido Caprino|1|0|Ended
tt0436262|Ellie Parker|2005|Comedy, Drama|A hilarious comic portrait of a young woman s struggle for integrity, happiness and a Hollywood acting career.|Naomi Watts, Jennifer Syme, Greg Freitas, Gaye Pope|1|0|Ended
tt0250081|Storytelling|2001|Comedy, Drama, Romance|College and high school serve as the backdrop for two stories about dysfunction and personal turmoil.|Selma Blair, Leo Fitzpatrick, Robert Wisdom, Maria Thayer|1|0|Ended
tt0877057|Death Note|2006|Animation, Crime, Drama|An intelligent high school student goes on a secret crusade to eliminate criminals from the world after discovering a notebook capable of killing anyone whose name is written into it.|Mamoru Miyano, Brad Swaile, Vincent Tong, Ryô Naitô|1|0|Ended
tt1003005|Room 205|2007|Horror|Wanting to start a fresh, Katrine moves from the province into a dormitory in Copenhagen and enrolls at the University. But when she crosses conniving Sanne by getting together with Sanne s...|Neel Rønholt, Mikkel Arendt, Julie R. Ølgaard, Mira Wanting|1|0|Ended
tt0418982|Offscreen|2006|Drama, Horror, Romance|Actor Nicolas Bro reigns supreme in the role of Nicolas Bro # a man intent on making a film about himself. After his director friend Christoffer Boe lends him a camera, his selfmonitoring is so hair-raisingly private that it becomes impossible to separate fact from fiction.|Nicolas Bro, Lene Maria Christensen, Karen Margrethe Bjerre, Christoffer Boe|1|0|Ended
tt0466500|Life Hits|2006|Drama|Christina is living in a suburb to Copenhagen. With her class mates Cecilie, Trine and Pernille, a tight-knit gang of girlfriends, she slacks her schoolwork, living mostly for the weekends ...|Laura Christensen, Stephanie Leon, Julie R. Ølgaard, Sara Møller Olsen|1|0|Ended
tt0338418|Old, New, Borrowed and Blue|2003|Comedy, Drama, Romance|Katrine is getting married. Her boyfriend s discretion, their apartment is great, her in-laws is okay. Katrine has only one problem, she has sometimes so difficult to tell the truth. A few ...|Kim Fupz Aakeson, Ibrahim Atilla Agyun, Lotte Andersen, Kaare Bjerkø|1|0|Ended
tt0776804|Triple Dare|2006|Drama|Three teenage girls create their own rite of passage into adulthood, forcing one another to face sexual challenges and cross many boundaries.|Emma Leth, Cathrine Bjørn, Amalie Lindegård, Sebastian Jessen|1|0|Ended
tt0484368|Clash of Egos|2006|Comedy|Tony (Ulrich Thomsen) is angry and wants his money back after watching world-famous director, Claus Volter s (Nikolaj Lie Kaas) new film. Tony just got out of prison for violent behavior.|Ulrich Thomsen, Nikolaj Lie Kaas, Mille Dinesen, Line Kruse|1|0|Ended
tt3909336|Worlds Apart|2008|Drama, Romance|Three separate narratives each following a love story between a foreigner and a Greek. Each story represents a different generation falling in love during a time of socioeconomic turmoil ...|J.K. Simmons, Christopher Papakaliatis, Andrea Osvárt, Maria Kavoyianni|1|0|Ended
tt1095423|Journey to Saturn|2008|Animation, Action, Adventure|A danish crew of misfits travel to Saturn in search for natural resources. However, the planet is colonized by a ruthless army of Aliens that turn their eye on Earth and invade Denmark. ...|Casper Christensen, Frank Hvam, Ali Kazim, Simon Jul Jørgensen|1|0|Ended
tt0855975|Prague|2006|Drama|Christoffer and Maja s trip to Prague to bring back Chistoffer s deceased father evolves into the story of a break-up. In the wake of the events that follow, secrets gradually emerge which threaten to destroy their marriage.|Mads Mikkelsen, Stine Stengade, Borivoj Navrátil, Jana Plodková|1|0|Ended
tt0419434|American Hardcore|2006|Documentary, History, Music|The History of American Punk Rock 1980-1986|Lucky Lehrer, Vic Bondi, Joe Keithley, Keith Morris|1|0|Ended
tt1210351|Lost Islands|2008|Comedy, Drama|A family in the 80s with five kids get into a crisis when twin brothers fall in love with the same girl.|Oshri Cohen, Michael Moshonov, Shmil Ben Ari, Orly Silbersatz Banai|1|0|Ended
tt0768183|Day Zero|2007|Drama|The military draft is back, three best friends are drafted and given 30 days to report for duty. In that time, they re forced to confront everything they believe about courage, duty, love, friendship and honor.|Elijah Wood, Chris Klein, Jon Bernthal, Ginnifer Goodwin|1|0|Ended
tt0420015|Nine Lives|2005|Drama|Captives of the very relationships that define and sustain them, nine women resiliently meet the travails and disappointments of life.|Elpidia Carrillo, Aomawa Baker, Miguel Sandoval, Mary Pat Dowhy|1|0|Ended
tt0105695|Unforgiven|2009|Drama, Western|Retired Old West gunslinger William Munny reluctantly takes on one last job, with the help of his old partner and a young man.|Clint Eastwood, Gene Hackman, Morgan Freeman, Richard Harris|1|0|Ended
tt0853267|Vampire Diary|2007|Drama, Fantasy, Horror|Whilst making a documentary, filmmaker Holly meets the highly enigmatic and beautiful Vicki who claims she is a real-life vampire. By turns fascinated by and attracted to her, Holly thinks ...|Anna Walton, Morven Macbeth, Jamie Thomas King, Kate Sissons|1|0|Ended
tt0283632|They|2002|Horror, Mystery, Thriller|A psychology student finds all her childhood fears and phobias becoming real after a traumatic event.|Laura Regan, Marc Blucas, Ethan Embry, Dagmara Dominczyk|1|0|Ended
tt1087861|Aching Hearts|2009|Drama, Romance|A bunch of 15-year-olds in Viborg make their first experiences with love, kissing and sexuality, coming together and drifting apart. The film follows the adolescents over a ...|Thomas V. Solnæs, Sofie Linde Lauridsen, Jesper Svane, Simone Tang|1|0|Ended
tt1158889|Little Soldier|2008|Drama|A soldier returning from war is hired by her own father to drive his prostitutes around town. She calls upon herself to help one of them.|Trine Dyrholm, Lorna Brown, Finn Nielsen, Rasmus Botoft|1|0|Ended
tt0315152|If I Were a Rich Man|2002|Comedy|Between Alice, a hospital nurse and Aldo, a shampoo sales representative, things have turned sour of late. Alice blames her husband for lacking ambition and contemplates divorce.One day ...|Jean-Pierre Darroussin, Valeria Bruni Tedeschi, Richard Berry, François Morel|1|0|Ended
tt0867609|With Your Permission|2007|Comedy, Drama, Romance|Ordinary Jan has no easy life. He is by far the most unpopular employee at work. At home it s even worse. His marriage with the not so ordinary Bente is on the verge of a breakdown. Jan s ...|Lars Brygmann, Sidse Babett Knudsen, Nicolaj Kopernikus, Rasmus Bjerg|1|0|Ended
tt1135489|Endgame: Blueprint for Global Enslavement|2007|Documentary|"For the New World Order, a world government is just the beginning. Once in place they can engage their plan to exterminate 80% of the world s population, while enabling the ""elites"" to live..."|Jim Tucker, Daniel Estulin, Alex Jones, Michael Coffman|1|0|Ended
tt0962736|The Young Victoria|2009|Biography, Drama, History|A dramatization of the turbulent first years of Queen Victoria s rule, and her enduring romance with Prince Albert.|Emily Blunt, Rupert Friend, Paul Bettany, Miranda Richardson|1|0|Ended
tt1324062|Zoomers|2009|Family|Two boys and an electric kettle, a robot, 100 surveillance cameras and a girl named Thea.|Frederik Ludvig Mansa, Sophus Emil Løkkegaard, Emilie Løvenstein Vegeberg, Simon Maagaard Holm|1|0|Ended
tt1046183|Mirageman|2007|Action, Comedy, Crime|A club bouncer with a dark past and great fighting skills decides to become a superhero.|Marko Zaror, María Elena Swett, Ariel Mateluna, Mauricio Pesutic|1|0|Ended
tt0823704|Peter Kay: Live at the Manchester Arena|2005|Comedy|N/A|Peter Kay, Gordon Isaacs, Karl Lucas|1|0|Ended
tt1425253|Shadow|2010|Horror|When a young soldier leaves for a mountain biking excursion, he meets the girl of his dreams as well as a group of violent locals who want to see them dead at any cost.|Jake Muxworthy, Karina Testa, Ottaviano Blitch, Chris Coppola|1|0|Ended
tt1627934|Sasirekha Parinayam|2009|Romance|N/A|Genelia D Souza, Tarun, Aahuthi Prasad, Gopalakrishna Paruchuri|1|0|Ended
tt1043651|Dark Island|2010|Action, Sci-Fi, Thriller|Soldiers and scientists visit a remote island, the site of bio-weapons research, after losing contact with the staff there.|Tess Panzer, Brandon Laatsch, Tate Ammons, Eric Raymond Lim|1|0|Ended
tt0895777|Oh My God!|2007|Comedy, Musical|During the Carnival in the historical site of Pelourinho (Salvador, Bahia, Brazil), we follow the lives of the tenants of a falling-to-pieces tenement house who try to get by using creativity, irony, humor and music.|Lázaro Ramos, Dira Paes, Wagner Moura, Stênio Garcia|1|0|Ended
tt1198153|The Assassin Next Door|2009|Action, Drama, Thriller|A woman forced to work for the Russian Mafia as an assassin agrees to help her next-door neighbor kill her abusive husband.|Olga Kurylenko, Zohar Shtrauss, Reymonde Amsallem, Liron Levo|1|0|Ended
tt0841175|Love for Sale|2008|Drama|In order to get funds, a young woman living in the Northeast of Brazil decides to raffle her own body.|Hermila Guedes, Maria Menezes, Zezita Matos, João Miguel|1|0|Ended
tt1119123|Accidents Happen|2009|Comedy, Drama|There are dysfunctional families... and then there are the Conways. After a family tragedy, 15-year-old Billy Conway has become the de facto glue between his bitter mom, distant brother, ...|Geena Davis, Harrison Gilbertson, Harry Cook, Joel Tobeck|1|0|Ended
tt1013743|Knight and Day|2010|Action, Comedy, Romance|A young woman gets mixed up with a disgraced spy who is trying to clear his name.|Tom Cruise, Cameron Diaz, Peter Sarsgaard, Jordi Mollà|1|0|Ended
tt0480572|Pyaar Ke Side Effects|2006|Comedy, Drama, Romance|Bengal-speaking Siddharth Bose lives a middle-classed lifestyle in Delhi along with his mother, and sister, Shalini. Their dad had abandoned them years ago. Shalini gets married to Kapil ...|Rahul Bose, Mallika Sherawat, Ranvir Shorey, Sharat Saxena|1|0|Ended
tt0217007|Risk|2007|Drama, Crime, Thriller|A naïve insurance adjuster comes under the tutelage of his jaded boss and gets caught in a web of deceit and lust.|Tom Long, Claudia Karvan, Melissa Madden-Gray, Bryan Brown|1|0|Ended
tt1600439|Shaapit|2010|Action, Drama, Horror|N/A|Aditya Narayan, Shweta Agarwal, Shubh Joshi, Natasha Sinha|1|0|Ended
tt0084740|Sur|2002|Drama, Romance|The movie tells a melancholic story of a little girl who is living in a city in the north. She is fascinated by the secrets of the south which seem to be hidden in the personality of her ...|Omero Antonutti, Sonsoles Aranguren, Icíar Bollaín, Lola Cardona|1|0|Ended
tt0175058|The Powerpuff Girls|2002|Animation, Action, Comedy|Three super-powered little girls constantly save the world (or at least the city of Townsville) from monsters, would-be conquerers and a few other gross things.|Cathy Cavadini, Tara Strong, Elizabeth Daily, Tom Kenny|1|0|Ended
tt2224026|Home|2003|Animation, Adventure, Comedy|An alien on the run from his own people makes friends with a girl. He tries to help her on her quest, but can be an interference.|Jim Parsons, Rihanna, Steve Martin, Jennifer Lopez|1|0|Ended
tt1326238|Backlight|2010|Drama, Mystery, Sci-Fi|Several characters who are each at critical stages of their lives are strangely impelled towards an uncharted lake in the middle of the desert where they all have the opportunity to save each other.|Joaquim de Almeida, Michelle Mania, Skyler Day, Scott Bailey|1|0|Ended
tt0269499|My Wife Is an Actress|2001|Comedy, Drama, Romance|"A ""normal"" guy who is married to a hot actress gets worried that she is involved with her costar. This worry turns into jealousy and causes problems in their relationship. This is a story about trust and a comedy about the actions between men and women."|Charlotte Gainsbourg, Yvan Attal, Terence Stamp, Noémie Lvovsky|1|0|Ended
tt0310778|Bon voyage|2003|Comedy, Drama, Mystery|An actress, a writer, a student, and a government worker band together in an effort to escape Paris as the Nazis move into the city.|Isabelle Adjani, Gérard Depardieu, Virginie Ledoyen, Yvan Attal|1|0|Ended
tt0099733|Happily Ever After|2004|Family, Animation, Musical|The Evil Queen is dead and Snow White is on her way to see the 7 dwarves when Lord Maliss, the Queen s brother, sees her in the looking glass. He attacks her in the form of a dragon, taking...|Edward Asner, Irene Cara, Carol Channing, Dom DeLuise|1|0|Ended
tt1186653|Inside Paris|2006|Adult|N/A|Michael Lucas, Zoltan, Marc Nickman, Ryan Michaels|1|0|Ended
tt1111948|Soul Men|2008|Comedy, Drama, Music|Though it s been some twenty years since they have spoken with one another, two estranged soul-singing legends agree to participate in a reunion performance at the Apollo Theater to honor their recently deceased band leader.|Samuel L. Jackson, Bernie Mac, Sharon Leal, Adam Herschman|1|0|Ended
tt4823752|The King of the Hill|2007|Short, Comedy, Drama|Jo and Jay, two typical suburban teenagers, are constantly challenging each other at the  king of the hill  game. But during this last day of summer, they will also have to confront their ...|Jordane Houde, Jérémie L Espérance|1|0|Ended
tt1322116|Mes amis, mes amours|2008|Comedy|N/A|Florence Pernel, Bernard Yerlès, Elise Tielrooy, Julien Frison|1|0|Ended
