tt2066982|The Arm|2013|Short, Comedy, Drama|In an attempt to keep up with social pressure in a technologically advanced world, Chance starts a texting relationship with Genevieve - a girl he meets at a yogurt shop. But when Genevieve...|Miles Heizer, Logan Miller, Matt Bennett, Ryan Alvarez|1|0|Ended
tt3831026|Seventh Submarine|2014|Documentary, Short|A film that mines (as in mining) the disjointed and fragmented minds of gifted quiz kids who are never given the chance to answer the question. What reptile is a natural submarine? Is that ...|N/A|1|0|Ended
tt1606308|Out of the Sun|2002|Short|N/A|N/A|1|0|Ended
tt3494858|Revolt|2015|Action, Crime, Drama|A drug runner decides to turn the tables on his longtime employer -- a powerful drug lord and gangster -- by paying him back in piles of revenge.|Rand Martin, Fattaneh, Mansour Sepehrnia, Jerryd Luck|1|0|Ended
tt1333015|The Shift|2014|Drama|In this compelling film, Dr. Wayne W. Dyer explores the spiritual journey from ambition to meaning.|Wayne Dyer, Portia de Rossi, Edward Kerr, Michael DeLuise|1|0|Ended
tt2044877|The Last Hug|2011|Short, Drama, Family|THE LAST HUG is the story of a young girl brought up by a single mother. Her quest for finding out who her father is brings her closer to the mother for the first time.|Jennifer Blankenship, Jay Disney, Quincey Krull, Walt Sloan|1|0|Ended
tt0815186|John Lennon: The Messenger|2002|Documentary, Music|Using rare footage, this is a spotlight on John Lennon that looks at his life before and after the break up of The Beatles plus the events that helped to shape the man and his beliefs. The ...|John Lennon|1|0|Ended
tt3317282|Videoclub|2014|Action, Horror, Romance|"In 1992, a young man who works at a video store takes shelter in it (along with his friends and family) during a ""possible"" zombie invasion."|Pedro Campos, Luciana Echeverría, Francisca Díaz, Samuel González|1|0|Ended
tt0762073|Thirst|2012|Fantasy, Horror|Through a failed medical experiment, a priest is stricken with vampirism and is forced to abandon his ascetic ways.|Kang-ho Song, Ok-bin Kim, Hae-suk Kim, Ha-kyun Shin|1|0|Ended
tt0275799|Xtracurricular|2003|N/A|N/A|Maria Jones, Michelle Fairbanks, Matthew Jones, Faith Schoenfeld|1|0|Ended
tt3176104|Anger of the Dead|2015|Short, Drama, Horror|Alice and Nicholas survived an epidemic that ravaged the world, now only inhabited by the undead. But the nightmare is not over; the rumbling of a motorcycle approaches, breaking the ...|Beatrice Baldaccini, Alessio Barzocchini, Emanuele Battini, Serena Bilanceri|1|0|Ended
tt4587414|Insides|2015|Short, Horror, Sci-Fi|Two women, each with a strange scar that they can t remember getting, fall ill after suffering violent dreams involving an ominous tunnel.|Karen Wilmer, Morgan Poferl|1|0|Ended
tt0061814|The Incident|2013|Crime, Drama, Thriller|Late one night, two young toughs hold hostage the passengers in one car of a New York subway train.|Victor Arnold, Robert Bannard, Beau Bridges, Ruby Dee|1|0|Ended
tt2124861|Mud and Guts - The Search for Water in La Gonave, Haiti|2013|Documentary, Biography|Two months drilling for water on the impoverished island of La Gonave, Haiti.|N/A|1|0|Ended
tt4149354|Spoonin  The Devil|2015|Short, Comedy, Drama|After the death of her husband Victoria, with her niece Samantha in tow, begrudgingly takes his ashes to their final resting place. Dumping spoonfuls of his ashes along the way.|Natalie Canerday, Kayla Esmond, Keith Hudson, Michael Stratton Carpenter|1|0|Ended
tt0247119|Mysterious Ways|2015|Drama, Fantasy, Sci-Fi|Declan Dunn is an anthropology professor who believes in miracles and other wonders. When he hears of a miraculous thing he goes out to find out if it s an actual miracle. Peggy Fowler is ...|Adrian Pasdar, Rae Dawn Chong, Alisen Down|1|0|Ended
tt2152731|Generation Me|2012|Comedy, Music, Romance|Dating in the age of social networking.|Laura Aidan, Caleb Barwick, Ben Baxter, Dru Fay|1|0|Ended
tt1212067|Brahma|2014|Action|N/A|Aishwarya, Mohan Babu|1|0|Ended
tt2780588|Silverhide|2015|Horror, Mystery, Thriller|Silverhide is a horror/thriller film exploring Government conspiracy and secrets too horrifying to imagine.|Kelly Wines, Lucy Clarvis, Jordan Murphy, Matt Brewer|1|0|Ended
tt3714366|The Mothman Curse|2014|Horror|An Ancient Evil Unleashed. A supernatural thriller based on the terrifying legend of The Mothman. Rachel and Katy work together in a large, empty museum.|Rachel Dale, Stephen Glover, Daniel Mansfield, Darren Munn|1|0|Ended
tt2208172|Everything Will Be Alright|2012|Documentary, Comedy|This film goes behind the scenes and under the skin of a unique live theater production. Film director Niko von Glasow brings together a company of performers to conceive and perform a new ...|Jana Zöll, Nico Randel, Mirco Monshausen, Manon Wetzel|1|0|Ended
tt1277939|Ein Dorf sieht Mord|2009|Crime|N/A|August Zirner, Lavinia Wilson, Thomas Thieme, Corinna Harfouch|1|0|Ended
tt3098858|Whip Brawler|2013|Short, Comedy, Sport|An accountant trains for a dreamed Mixed Martial Arts match set up by a trusted friend. As his journey progresses we see the true colors of his family and find out know one knows the answer to who his opponent will be.|Jesse Markus, Melissa Singleton, Rosalie Bertrand, Jourdan Dixon|1|0|Ended
tt4086116|The Amityville Playhouse|2015|Horror|Following the tragic death of her parents Fawn Harriman discovers she has inherited a theatre in the town of Amityville. She, along with 3 friends, decides to spend the weekend there ...|Monèle LeStrat, Linden Baker, Kennie Benoit, Hollie Anne Kornik|1|0|Ended
tt1662636|Big Birding Day|2010|Documentary, Short, Adventure|A glimpse into the world of competitive birdwatching, as three friends attempt to see as many species as possible in 24 hours.|Dave Mackay, Marty Riback, Chris Hitt, Armando Mejia|1|0|Ended
tt1608347|Bikini Lighters|2009|Short, Adventure, Drama|After shoplifting lighters, three young friends venture into the woods behind their neighborhood to create an explosion.|Alex Fast, Jack Platner|1|0|Ended
tt0311614|Out of Step|2002|Drama|Graced with the instinctive ability to dance, Jenny Thomas wants nothing more than to become a professional dancer. All of her hard work pays off when she is accepted to a prominent dance ...|Alison Akin Clark, Michael Buster, Jeremy Hoop, Nicolle White-Robledo|1|0|Ended
tt2752758|Devil s Due|2011|Horror, Mystery|After a mysterious, lost night on their honeymoon, a newlywed couple finds themselves dealing with an earlier-than-planned pregnancy.|Allison Miller, Zach Gilford, Sam Anderson, Roger Payano|1|0|Ended
tt2226630|After Words|2015|Drama|A librarian facing a mid-life crisis travels to Costa Rica.|Marcia Gay Harden, Huguette Urhausen, Ron Canada, Yvette Thor|1|0|Ended
tt1357222|Watchmaker|2013|Animation, Short|Watchmaker is a roller coaster ride for the eyes, using a mix of live action and hand-made cinema set to the music of the Tom Fun Orchestra|N/A|1|0|Ended
tt0286253|Two for One|2015|Comedy|N/A|Eddie Blissett, Shannon Delk, Christopher Fisher, Bruce Gray|1|0|Ended
tt4799672|Suamiku Jatuh Dari Langit|2015|Comedy|N/A|Nora Danish, Qi Razali, Atikah Suhaime|1|0|Ended
tt0387649|The Trumouse Show|2003|Comedy, Animation, Short|N/A|N/A|1|0|Ended
tt1613037|Kaptan Feza|2010|Action|N/A|Hakan Karahan, Meral Okay, Ahmet Mümtaz Taylan, Mine Tugay|1|0|Ended
tt0815122|Buster Keaton: From Silents to Shorts|2006|Documentary, Short|N/A|Ed Watz, Roscoe  Fatty  Arbuckle, Vernon Dent, Buster Keaton|1|0|Ended
tt2992162|Gradually...|2006|Animation, Short, Music|On monitors and glass surfaces in a dark room scenes of a train journey appear: Interior and exterior space, stasis and movement, rhythm and abstraction as well as processes of perception ...|Ileana Florentina Tautu|1|0|Ended
tt1125808|Hafez|2007|Drama, Romance|A young man named Shamsadin (Mehdi Moradi) receives the title of Hafez, bestowed only on those who memorize the Koran, and is sent to teach it to Nabat (Aso), the overseas-raised daughter ...|Kumiko Asô, Mehdi Morady, Mehdi Negahban, Sasan Parsi|1|0|Ended
tt1602586|Paid Programming: Icelandic Ultra Blue|2009|Short, Comedy|Learn about a revolutionary new drug (not to mention Nazi gold and chest rashes) in this informative (and totally fake) infomercial.|John Serge, Rose Ackerish, Singing Auditioner, Christopher Cusumano|1|0|Ended
tt1523486|Kolpaçino|2009|Action, Comedy|A group of men try to save themselves from two bodies.|Safak Sezer, Aydemir Akbas, Ali Çatalbas, Ali Sürmeli|1|0|Ended
tt0447659|Flying Lessons|2010|Drama|N/A|Giovanna Mezzogiorno, Andrea Miglio Risi, Tom Angel Kharumaty, Flavio Bucci|1|0|Ended
tt1107948|Saving Grace B. Jones|2009|Drama, Thriller|In a 1950s-era Missouri town the life of a couple is thrown into chaos when the husband s sister is released from the local asylum and comes to live with the family.|Michael Biehn, Tatum O Neal, Penelope Ann Miller, Joel Gretsch|1|0|Ended
tt0324689|American Roots Music|2001|Documentary, Music|N/A|Arlo Guthrie, B.B. King, Bonnie Raitt, Pete Seeger|1|0|Ended
tt0853153|Stuart: A Life Backwards|2007|Drama|A writer takes a backwards look at the life of his unlikely friend Stuart, a homeless alcoholic who experienced a traumatic event in his childhood.|Benedict Cumberbatch, Tom Hardy, Nicola Duffett, Claire-Louise Cordwell|1|0|Ended
tt3655522|Girlhood|2003|Drama|A girl with few real prospects joins a gang, reinventing herself and gaining a sense of self confidence in the process. However, she soon finds that this new life does not necessarily make her any happier.|Karidja Touré, Assa Sylla, Lindsay Karamoh, Mariétou Touré|1|0|Ended
tt1534085|Beyond the Black Rainbow|2010|Sci-Fi, Thriller|Despite being under heavy sedation, a young woman tries to make her way out of the Arboria Institute, a secluded, quasifuturistic commune.|Michael Rogers, Eva Bourne, Scott Hylands, Rondel Reynoldson|1|0|Ended
tt1439562|Orgasm Inc.|2009|Documentary|Extraordinary behind-the-scenes access reveals a drug company s fevered race to develop the first FDA-approved Viagra for women - and offers a humorous but sobering look inside the cash-fueled pharmaceutical industry.|Elizabeth Canner, Darby Stephens, Virgil Place, Leland Wilson|1|0|Ended
tt0380585|Red Nose|2003|Comedy, Romance|Coincidentally, a critic and a writer team up for Operation Nez Rouge. It seeks to take revenge on him for a very negative criticism until she falls in love. But he plays double game with her?|Patrick Huard, Michèle-Barbara Pelletier, Pierre Lebeau, Christian Bégin|1|0|Ended
tt0485510|Killing the Shadows|2006|Comedy, Drama, History|A story about the tragedy and the danger of humor and the humorist - A comedy as grand as the Lands of Rome...|Haluk Bilginer, Sebnem Dönmez, Beyaz, Güven Kiraç|1|0|Ended
tt4936176|Mascots|2016|Comedy|A look into the world of competitive mascots.|Zach Woods, Wayne Wilderson, Sarah Baker, Michael Hitchcock|1|0|Ended
tt0329476|Out of Order|2014|Drama, Romance|An unsatisfying marriage leads a man to consider a relationship with someone else.|Eric Stoltz, Felicity Huffman, Kim Dickens, Dyllan Christopher|1|0|Ended
tt0386824|War Takes|2003|Documentary|N/A|N/A|1|0|Ended
tt0436428|El inmortal|2005|Documentary|A family is torn apart by the conflict in Nicaragua, leaving brother fighting brother and illustrating religious manipulation, male chauvinism and poverty as part of the destructive legacy of war.|N/A|1|0|Ended
tt4892714|Fall in Love Like a Star|2015|Romance|A superstar musician falls in love with his manager and struggles to choose between his career and true love.|Yi Feng Li, Mi Yang, Shu Chen, Yao Qing Wang|1|0|Ended
tt0094663|Another Woman|2015|Drama|N/A|Gena Rowlands, Mia Farrow, Ian Holm, Blythe Danner|1|0|Ended
tt0117442|Rasputin|2015|Biography, Drama, History|"HBO biopic about the infamous ""mad monk"" Rasputin from the court of Tsar Nicholas in Russia."|Alan Rickman, Greta Scacchi, Ian McKellen, David Warner|1|0|Ended
tt4182688|Einfach Rosa – Wolken über Kapstadt|2015|Drama|Mark and Nandi, living in Berlin have decided to get married at the estate of her mother Jamila in Capetown, South Africa. Rosa and Meral have been asked to organize their wedding and have ...|Alexandra Neldel, Janek Rieke, Pearl Thusi, Sandi Schultz|1|0|Ended
tt1326197|Third Party President: Citizen Rocky|2016|Documentary|This feature length high definition documentary follows one of the Nation s most controversial yet progressive leaders, 2012 Presidential candidate and Former two-term Salt Lake City Mayor ...|Richard Dreyfuss, Larry King, Mary Mapes, Ralph Nader|1|0|Ended
tt0475267|Fatigue|2005|Thriller|N/A|Sophie Coryndon, Ross Cowley, Ian Culverhouse, Chris Dawson|1|0|Ended
tt2578578|The Note 2 : Taking a Chance on Love|2011|Documentary, Short|A recap of the movie, The Note (2007) as a bonus feature for the movie Taking a Chance on Love (2009).|Genie Francis, Ted McGinley|1|0|Ended
tt0286594|Close Your Eyes|2002|Crime, Horror, Mystery|A hypnotherapist is caught up in the pursuit of a serial killer.|Shirley Henderson, Goran Visnjic, Miranda Otto, Sophie Stuckey|1|0|Ended
tt0250274|The Brothers|2001|Comedy, Drama|Four friends begin to question women and relationships when one of them announces impending nuptials.|Morris Chestnut, D.L. Hughley, Bill Bellamy, Shemar Moore|1|0|Ended
tt1098356|Long Weekend|2009|Drama, Horror, Thriller|A vacationing couple in the wilderness learns what happens when they disrespect nature.|Jim Caviezel, Claudia Karvan, Star, John Brumpton|1|0|Ended
tt0411646|Michael Moore Hates America|2004|Documentary|Michael Wilson, like the subject of his film, is trying to get an interview with a multi-millionaire; however, in this case, that millionaire is Michael Moore himself.|Mike Abraham, Pete Auger, Andrew Breitbart, Dinesh D Souza|1|0|Ended
tt0912597|Death Note - L: Change the WorLd|2008|Crime, Drama, Thriller|"A spin-out sequel to the popular Japanese thriller. This time it focuses on the character ""L."""|Ken ichi Matsuyama, Michael Adamthwaite, Sota Aoyama, Shannon Chan-Kent|1|0|Ended
tt1369567|Russell Peters: Red, White and Brown|2008|Comedy|N/A|Melle Mel, Russell Peters|1|0|Ended
tt1419615|Frogs & Toads|2009|Animation, Short|N/A|N/A|1|0|Ended
tt1388331|Chris Botti in Boston|2009|Music|N/A|Chris Botti, Josh Groban, Keith Lockhart, Yo-Yo Ma|1|0|Ended
tt0327036|Martin Lawrence Live: Runteldat|2002|Documentary, Biography, Comedy|After undergoing a number of personal crises, a stand-up comic returns to the stage for a one-man show featuring stinging social commentary and very personal reflections about his life.|Martin Lawrence, Nancy O Dell, Paul Keeley, Art Cohan|1|0|Ended
tt1017461|Sympathy|2007|Drama, Horror, Mystery|When a reckless bank robber and his rebellious teenage hostage hole up for the night in a bad motel, anything can happen. A mysterious stranger and dark twists of fate send this night into ...|Marina Shtelen, Aaron Boucher, Steven Pritchard|1|0|Ended
tt0855011|Mrs. Ratcliffe s Revolution|2007|Comedy|She left the land of Marks & Spencer and went to the world of Marx and Lenin. Mrs Ratcliffe s Revolution is a feelgood comedy following one dysfunctional family s journey from 1968 West ...|Catherine Tate, Iain Glen, Brittany Ashworth, Heike Makatsch|1|0|Ended
tt0458352|The Devil Wears Prada|2006|Comedy, Drama|A smart but sensible new graduate lands a job as an assistant to Miranda Priestly, the demanding editor-in-chief of a high fashion magazine.|Meryl Streep, Anne Hathaway, Emily Blunt, Stanley Tucci|1|0|Ended
tt0253754|Star Trek: Nemesis|2002|Action, Adventure, Sci-Fi|The Enterprise is diverted to the Romulan homeworld Romulus, supposedly because they want to negotiate a peace treaty.|Patrick Stewart, Jonathan Frakes, Brent Spiner, LeVar Burton|1|0|Ended
tt0395169|Hotel Rwanda|2004|Drama, History, War|Paul Rusesabagina was a hotel manager who housed over a thousand Tutsi refugees during their struggle against the Hutu militia in Rwanda.|Xolani Mali, Don Cheadle, Desmond Dube, Hakeem Kae-Kazim|1|0|Ended
tt0287624|Paradise Found|2003|Biography, Drama|N/A|Kiefer Sutherland, Nastassja Kinski, Alun Armstrong, Thomas Heinze|1|0|Ended
tt0276820|Berlin is in Germany|2001|Drama|When Martin, a former GDR citizen, is released from jail, he lately becomes confronted with the consequences of the German re-unification.|Jörg Schüttauf, Julia Jäger, Robin Becker, Robert Lohr|1|0|Ended
tt0489270|Saw III|2006|Horror|Jigsaw kidnaps a doctor to keep him alive while he watches his new apprentice put an unlucky citizen through a brutal test.|Tobin Bell, Shawnee Smith, Angus Macfadyen, Bahar Soomekh|1|0|Ended
tt0432348|Saw II|2005|Horror, Mystery|A detective and his team must rescue eight people trapped in a factory by the twisted serial killer known as Jigsaw.|Tobin Bell, Shawnee Smith, Donnie Wahlberg, Erik Knudsen|1|0|Ended
tt0367882|Indiana Jones and the Kingdom of the Crystal Skull|2008|Action, Adventure, Fantasy|"Famed archaeologist/adventurer Dr. Henry ""Indiana"" Jones is called back into action when he becomes entangled in a Soviet plot to uncover the secret behind mysterious artifacts known as the Crystal Skulls."|Harrison Ford, Cate Blanchett, Karen Allen, Shia LaBeouf|1|0|Ended
tt0441909|Volver|2006|Comedy, Crime, Drama|After her death, a mother returns to her home town in order to fix the situations she couldn t resolve during her life.|Penélope Cruz, Carmen Maura, Lola Dueñas, Blanca Portillo|1|0|Ended
tt0281190|Shottas|2002|Action, Crime, Drama|This movie is about crime connected to selling drugs and extortion, hence the title. The crimes which start off in Jamaica then move to USA.|Ky-Mani Marley, Spragga Benz, Louie Rankin, Paul Campbell|1|0|Ended
tt0384699|Missing in America|2005|Drama, War|A haunted Vietnam veteran (Danny Glover), living in exile in the forests of the Pacific Northwest, is faced with a life-changing decision after he is visited by a former platoon member (...|Danny Glover, Ron Perlman, Linda Hamilton, Zoe Weizenbaum|1|0|Ended
tt0983909|Real Time|2008|Comedy, Drama|A gripping thriller about a hit man who gives a down-and-out compulsive gambler just one last hour to live.|Randy Quaid, Jay Baruchel, Jayne Eastwood, Lucy Filippone|1|0|Ended
tt1075417|Race to Witch Mountain|2009|Action, Adventure, Family|A Las Vegas cabbie enlists the help of a UFO expert to protect two siblings with paranormal powers from the clutches of an organization that wants to use the kids for their nefarious plans.|Dwayne Johnson, AnnaSophia Robb, Alexander Ludwig, Carla Gugino|1|0|Ended
tt0477392|Broken Bridges|2006|Drama, Music|A fading country music star (Keith) returns to his hometown, where he reunites with his childhood sweetheart and also meets his 16-year-old daughter for the first time.|Brian F. Durkin, Jason Leith, Richard Tillman, Toby Keith|1|0|Ended
tt0758786|Stuck|2007|Crime, Drama, Thriller|A young woman commits a hit-and-run, then finds her fate tied to her victim.|Mena Suvari, Stephen Rea, Russell Hornsby, Rukiya Bernard|1|0|Ended
tt0465430|The Cottage|2008|Comedy, Crime, Horror|In a remote part of the countryside, a bungled kidnapping turns into a living nightmare for four central characters when they cross paths with a psychopathic farmer and all hell breaks ...|Andy Serkis, Reece Shearsmith, Jennifer Ellison, Steven O Donnell|1|0|Ended
tt1227926|Dr. Horrible s Sing-Along Blog|2008|Comedy, Musical, Sci-Fi|An aspiring supervillain must balance his career and his pursuit of a beautiful do-gooder.|Neil Patrick Harris, Nathan Fillion, Felicia Day, Simon Helberg|1|0|Ended
tt0066769|The Andromeda Strain|2008|Sci-Fi, Thriller|A group of scientists investigates a deadly new alien virus before it can spread.|Arthur Hill, David Wayne, James Olson, Kate Reid|1|0|Ended
tt0822832|Marley & Me|2008|Comedy, Drama, Family|A family learns important life lessons from their adorable, but naughty and neurotic dog.|Owen Wilson, Jennifer Aniston, Eric Dane, Kathleen Turner|1|0|Ended
tt0327920|I Am Trying to Break Your Heart|2002|Documentary, Music|"First-time filmmaker and award-winning photographer Sam Jones documents the recording of Wilco s album, ""Yankee Hotel Foxtrot."""|Jeff Tweedy, John Stirratt, Leroy Bach, Glenn Kotche|1|0|Ended
tt0800027|Feast of Love|2007|Drama, Romance|A meditation on love and its various incarnations, set within a community of friends in Oregon. and is described as an exploration of the magical, mysterious and sometimes painful incarnations of love.|Morgan Freeman, Greg Kinnear, Radha Mitchell, Billy Burke|1|0|Ended
tt1710994|Loups=Garous|2010|Animation, Mystery, Sci-Fi|N/A|Kanae Oki, Hiromi Igarashi, Marina Inoue, Miyuki Sawashiro|1|0|Ended
tt1339133|No More Smoke Signals|2009|Documentary|N/A|John Trudell, Roxanne Two Bulls|1|0|Ended
tt0811047|Bleed with Me|2009|Horror, Thriller|Laura is having a day that can hardly get any worse, but then she stumbles into a cabdriver and things are about to get even worse.|Camilla Metelmann, Kim Sønderholm, Maja Muhlack, Mads Koudal|1|0|Ended
tt0309380|Blurred|2002|Comedy, Drama|Follows five groups of teenagers as they hit the road for Schoolies Week.|Tony Brockman, Travis Cotton, Jamie Croft, Jessica Gower|1|0|Ended
tt4791402|No Filter the Film|2015|Comedy|"Rhonda and Kim Hamilton are two highly successful cousins with vastly different philosophies on dating. One is sexually liberated (A ""Hoe"" according to Kim) and the other is getting over ..."|Denise Ashley, Pam Banks, Anthony R. Barnes, Donna Bey|1|0|Ended
tt4768190|Why She Cries|2015|Drama|Two sisters are trying to repair their relationship while one keeps a dark secret from the other. After crossing paths with a wealthy woman dealing with an illness that has caused her ...|James Black, Dustin Doan, Amanda Garrett, Whitney Hicks|1|0|Ended
tt0029529|Second Honeymoon|2001|Comedy, Romance|Newly remarried woman finds her businessman husband boring and runs into her wealthy playboy first husband.|Tyrone Power, Loretta Young, Stuart Erwin, Claire Trevor|1|0|Ended
tt0400156|Ambulance|2016|Drama, Thriller|"""Ambulance"" is a psychological thriller based on 3 rules: 1. The entire film must take place in only ONE LOCATION; an ambulance 2. The story must be in REAL TIME; a 80 minute ride 3. There must be only 4 CHARACTERS on the ride."|Thomas Bo Larsen, Paw Henriksen, Helle Fagralid, Torbjørn Hummel|1|0|Ended
tt5608908|The Trolleybus-Man|2016|Short, Comedy|An absurd superhero comedy about a mechanic turned superhero who s fighting to preserve thing he loves the most - the trolleybuses. Without the old trolleybuses, the city is never going to be the same.|Sarunas Datenis, Vytautas Kupsys, Liubomiras Laucevicius, Gabija Siurbyte|1|0|Ended
tt2226291|Another Station: Another Mile|2010|Documentary|Features performances of 14 songs recorded in locations throughout the world. These performances are interspersed with interviews with each band member of the Chicago based band revealing ...|Brandon Barnes, Joey Belladonna, Geoff Bilson, Zach Blair|1|0|Ended
tt0478687|Call Me Elisabeth|2006|Drama|A 10 year old girl lives in post WWII rural France with her parents, who are about to divorce. Her older sister leaves home to finish school, and the young girl is left with a mysterious, ...|Alba Gaïa Kraghede Bellugi, Stéphane Freiss, Maria de Medeiros, Yolande Moreau|1|0|Ended
tt1279086|The Genius of Charles Darwin|2008|Documentary|N/A|Richard Dawkins|1|0|Ended
tt0304636|The Riverman|2004|Biography, Crime, Drama|A series of interviews are conducted with convicted serial killer Ted Bundy in hopes of gaining insight into the Green River Killer who is terrorizing Seattle.|Bruce Greenwood, Sam Jaeger, Sarah Manninen, Kathleen Quinlan|1|0|Ended
tt1754394|Ragada|2010|Action, Comedy, Drama|N/A|Nagarjuna Akkineni, Anushka Shetty, Priyamani, Pradeep Singh Rawat|1|0|Ended
tt1286499|At the Edge of the World|2008|Documentary, Action, Adventure|At the Edge of the World chronicles the controversial Sea Shepherd Antarctic Campaign against a Japanese whaling fleet. The international volunteer crew, under-trained and under-equipped, ...|Paul Watson, Alex Cornelissen, Peter Hammarstedt, Benjamin Baldwin|1|0|Ended
tt0480239|Atlas Shrugged Part I|2011|Drama, Mystery, Sci-Fi|Railroad executive Dagny Taggart and steel mogul Henry Rearden form an alliance to fight the increasingly authoritarian government of the United States.|Taylor Schilling, Grant Bowler, Matthew Marsden, Edi Gathegi|1|0|Ended
tt0039725|Possessed|2009|Crime, Drama, Film-Noir|After being found wandering the streets of Los Angeles, a severely catatonic woman tells a doctor the complex story of how she wound up there.|Joan Crawford, Van Heflin, Raymond Massey, Geraldine Brooks|1|0|Ended
tt4365506|Open Tee Bioscope|2015|Drama|A rusticated boy in his adolescence comes to stay with his mother in North Kolkata and encounters some new experiences during his stay. The time-line of the story is in the 90 s typical Northern part of Kolkata.|Riddhi Sen, Surangana Banerjee, Dhee Majumder, Ritobroto Mukherjee|1|0|Ended
tt1629763|Comrade, Where Are You Today?|2016|Documentary|N/A|Kirsi Liimatainen|1|0|Ended
tt5541206|The Idea of a Lake|2016|Drama|Inès, 35 years old, is a photographer. She is in an emotionally fragile phase and begins putting together a book of personal poems and photographs. Gradually, the process of bringing a book...|Juan Barberini, Rosario Bléfari, Carla Crespo, Juan Greppi|1|0|Ended
tt4197474|Tatara Samurai|2016|Comedy|N/A|N/A|1|0|Ended
tt0898343|Petits secrets et gros mensonges|2007|N/A|N/A|Michèle Laroque, Thierry Neuvic, Carole Richert, Dominic Gould|1|0|Ended
tt5159408|Nibunan|2016|Crime, Thriller|N/A|Arjun, Sruthi Hariharan, Vaibhav Reddy, Varalaxmi Sarathkumar|1|0|Ended
