tt1183727|Lava storm|2008|Action, Drama, Sci-Fi|Lori and John Wilson, employees of an emergency response center, must find a way to survive the initial lava storms, to save John s father and their two teenage children. Even more ...|Ian Ziering, Valérie Valois, Vlasta Vrana, Nicole Maillet|1|0|Ended
tt0904128|Prom Wars: Love Is a Battlefield|2008|Comedy|The graduating class at Miss Aversham and Miss Cronstall s School for Girls find that they have - in defiance of the natural laws of probability - all blossomed simultaneously. Capitalizing...|Raviv Ullman, Rachelle Lefevre, Alia Shawkat, Kevin Coughlin|1|0|Ended
tt1283542|A Numbers Game|2010|Comedy|N/A|Madison Walls, Steven Bauer, Ken Howard, Alice L. Walker|1|0|Ended
tt0411396|Suicide|2004|Drama, Thriller|A website offers people to have their suicides filmed.|Markus Eberhard, Engelbert Weiss, Ralph Polinski, Katja Weber|1|0|Ended
tt1209364|Toe to Toe|2010|Drama|A story about two lacrosse teammates from opposite sides of the track.|Sonequa Martin-Green, Samantha Eustace, Louisa Krause, Maha Chehlaoui|1|0|Ended
tt1442584|All That I Love|2009|Comedy, Drama, Music|Follows four friends in their quest to form a punk band. As workers protests sweep across the country, Janek and Staszek, the sons of a navy man, the rebellious Kazik, and the affluent ...|Mateusz Kosciukiewicz, Olga Frycz, Jakub Gierszal, Andrzej Chyra|1|0|Ended
tt0833595|Guide de la petite vengeance|2006|Comedy, Drama, Thriller|N/A|Marc Béland, Gabriel Gascon, Michel Muller, Pascale Bussières|1|0|Ended
tt0247745|Super Troopers|2001|Comedy, Crime, Mystery|Five Vermont state troopers, avid pranksters with a knack for screwing up, try to save their jobs and out-do the local police department by solving a crime.|André Vippolis, Joey Kern, Geoffrey Arend, Erik Stolhanske|1|0|Ended
tt2866008|It s Always Snowing Somewhere|2008|N/A|"Burton presents ""It s Always Snowing Somewhere;"" a double feature snowboard movie that showcases the team s most ridiculous season yet. Winter never ends as the team travels from the ..."|Mikkel Bang, Terje Håkonsen, Mads Jonsson, Frederik Kalbermatten|1|0|Ended
tt1308747|Apples And Oranges|2007|Comedy|N/A|Jeff Shakoor, Zander Schaus, Deborah Baker Jr., Rachel Kimsey|1|0|Ended
tt1556175|Double Decade|2008|Action, Sci-Fi|N/A|Masahiro Inoue, Kimito Totani, Ryôta Murai, Kanna Mori|1|0|Ended
tt0841021|For Right Or Wrong|2006|Documentary, Action, Sport|Snowboard pioneer Jake Burton explains what it s like to live within the bubble of pro boarding in this documentary featuring footage of expert riders on and off the slopes, at home and during expeditions to the world s premier peaks.|Jake Burton, George Burton Carpenter, Kelly Clark, Danny Davis|1|0|Ended
tt0322674|Twin Sisters|2002|Drama, Romance, War|Twin Sisters is an epic love story based on the Dutch bestseller by Tessa de Loo that has been read by more than 3.5 million readers in Holland and Germany.|Ellen Vogel, Gudrun Okras, Thekla Reuten, Nadja Uhl|1|0|Ended
tt0430651|Survive Style 5+|2004|Fantasy, Mystery, Romance|Five bizarre stories with no apparent connection to one and other eventually become intertwined, resulting in surreal circumstances.|Tadanobu Asano, Reika Hashimoto, Kyôko Koizumi, Hiroshi Abe|1|0|Ended
tt0475984|Mister Lonely|2007|Comedy, Drama|In Paris, a young American who works as a Michael Jackson lookalike meets Marilyn Monroe, who invites him to her commune in Scotland, where she lives with Charlie Chaplin and her daughter, Shirley Temple.|Diego Luna, Samantha Morton, Denis Lavant, James Fox|1|0|Ended
tt0792986|Fear(s) of the Dark|2008|Animation, Horror, Mystery|Several scary black-and-white animated segments in different styles appeal to our fear(s) of the dark.|Gil Alma, Aure Atika, François Creton, Guillaume Depardieu|1|0|Ended
tt0417072|R-Point|2004|Action, Horror, War|During the Vietnam War, a South Korean base receives a radio transmission from a missing squad, presumed dead, and sends a platoon to rescue the lost squad from the R-Point.|Woo-seong Kam, Byung-ho Son, Sun-kyun Lee, Won-sang Park|1|0|Ended
tt0810827|Death Note: The Last Name|2006|Adventure, Crime, Drama|Picking up where the first one leaves off, Light joins the task force searching for Kira in an effort to avert suspicion from himself---and get rid of L.|Tatsuya Fujiwara, Takeshi Kaga, Shidô Nakamura, Erika Toda|1|0|Ended
tt0430895|Aurore|2005|Drama|After the sudden death of her mother, Aurore Gagnon is abused by her disturbed step-mother as her town remains in the silence followed by her death. Based on a true story.|Marianne Fortier, Serge Postigo, Hélène Bourgeois Leclerc, Yves Jacques|1|0|Ended
tt0462246|Darkon|2006|Documentary, Fantasy|Skip Lipman, a suburban stay at home dad, embarks on an epic quest to topple a mighty empire in a full-contact Live Action Role Playing Game known as Darkon.|Skip Lipman, Kenyon Wells, Daniel McArthur, Rebecca Thurmond|1|0|Ended
tt0968311|Taken in Broad Daylight|2009|Biography, Crime, Drama|The true and inspiring survival story of kidnapped teen, Anne Sluti, and how she manages to stay alive by manipulating her captor, engineering her own rescue and negotiating her safe release after 6 days of hell.|Sara Canning, James Van Der Beek, LeVar Burton, Diana Reis|1|0|Ended
tt0477079|Romancing the Bride|2005|Comedy, Romance|Melissa, is an American woman in beautiful Mexico for her wedding. Unfortunately, she wakes up handcuffed and married to an incredibly hot local Mexican named Carlos. Melissa has no ...|Matt Cedeño, Jen Drohan, José Antonio Estrada, Carrie Fisher|1|0|Ended
tt1046947|Last Chance Harvey|2008|Drama, Romance|In London for his daughter s wedding, a rumpled man finds his romantic spirits lifted by a new woman in his life.|Dustin Hoffman, Emma Thompson, Eileen Atkins, Kathy Baker|1|0|Ended
tt0439630|Initial D|2005|Action, Comedy, Drama|After winning his first competition, Takumi focuses his attention on drift racing, a sport he has unknowingly perfected while delivering tofu in his father s Toyota AE86.|Shawn Yue, Edison Chen, Jay Chou, Anthony Chau-Sang Wong|1|0|Ended
tt1063056|From Within|2009|Horror, Mystery, Thriller|A small Maryland town is gripped by a curse which causes residents to take their own life one after another.|Elizabeth Rice, Thomas Dekker, Kelly Blatz, Laura Allen|1|0|Ended
tt0377749|Dead Birds|2004|Horror, Thriller, Western|A group of Confederate soldiers hole up in an abandoned plantation after robbing a bank and find themselves at the mercy of supernatural forces.|Henry Thomas, Patrick Fugit, Nicki Aycox, Michael Shannon|1|0|Ended
tt1038072|Pulse 2: Afterlife|2008|Drama, Horror, Sci-Fi|After ghosts invade the human world through the Internet, a father must protect his daughter from the psychotic spirit of his ex-wife.|Todd Giebenhain, Diane Ayala Goldner, Rachel Robinson, Dodie Brown|1|0|Ended
tt0299422|100 Mile Rule|2002|Comedy|A dark comedy about three salesmen from Detroit who come to Los Angeles for a two week seminar and get themselves involved in a world of trouble when their  fun  snowballs into a ...|Jake Weber, Maria Bello, David Thornton, Michael McKean|1|0|Ended
tt1220706|Breathing Room|2008|Horror, Mystery, Thriller|Thrown naked into a desolate room with thirteen strangers, Tonya discovers that she is the final contestant in a deadly game. Restrained by lethal electronic collars, the players must ...|Ailsa Marshall, Michael McLafferty, David Higlen, Brad Culver|1|0|Ended
tt0265133|Crime Partners|2003|Crime|N/A|Tyrin Turner, John  B.J.  Bryant, Clifton Powell, Jeanette Branch|1|0|Ended
tt0461703|Skinwalkers|2006|Action, Fantasy, Horror|A 12 year old boy and his mother become the targets of two warring werewolf packs, each with different intentions and motives.|Jason Behr, Elias Koteas, Rhona Mitra, Natassia Malthe|1|0|Ended
tt0489282|Strange Wilderness|2008|Adventure, Comedy|With the ratings dropping for a wilderness-themed TV show, two animal fans go to the Andes in search of Bigfoot.|Steve Zahn, Allen Covert, Jonah Hill, Kevin Heffernan|1|0|Ended
tt1093374|Leaving Barstow|2008|Drama|Growing up in Barstow, CA, high school senior Andrew hopes for a bigger world -- but his devotion to his mother, Sandra, and his awakening attraction to newcomer Jenny, combine to keep him ...|Michelle Clunie, Kevin Sheridan, Ryan Michelle Bathe, Ryan Carnes|1|0|Ended
tt1169809|Book of Blood|2009|Drama, Horror, Mystery|"A paranormal expert discovers a house that is at the intersection of so-called ""highways"" transporting souls in the afterlife."|Jonas Armstrong, Sophie Ward, Clive Russell, Paul Blair|1|0|Ended
tt1284526|The Country Teacher|2008|Drama, Romance|Petr, youthful, quiet, and sensitive, comes from Prague to teach natural science in a country town. The gruff principal asks what he s running from and predicts he ll be gone in six months....|Pavel Liska, Zuzana Bydzovská, Ladislav Sedivý, Marek Daniel|1|0|Ended
tt1295071|Tales of the Black Freighter|2009|Animation, Short, Action|A mariner survives an attack from the dreaded pirates of the Black Freighter, but his struggle to return home to warn it has a horrific cost.|Gerard Butler, Cam Clarke, Siobhan Flynn, Jared Harris|1|0|Ended
tt0498203|Wholetrain|2006|Drama|This feature length documentary takes a look at the graffiti movement, and the young people who populate the niche culture. Following four such artists as they shape the graffiti community ...|Mike Adler, Florian Renner, Elyas M Barek, Jacob Matschenz|1|0|Ended
tt0478338|Žižek!|2005|Documentary|A look at the controversial author, philosopher and candidate for Slovenian presidency: Slavoj Zizek.|Slavoj Zizek|1|0|Ended
tt0454776|Amazing Grace|2006|Biography, Drama, History|The idealist William Wilberforce maneuvers his way through Parliament, endeavoring to end the British transatlantic slave trade.|Ioan Gruffudd, Romola Garai, Benedict Cumberbatch, Albert Finney|1|0|Ended
tt0928147|Little Britain Live|2006|Comedy|After three award-winning television series, Matt Lucas and David Walliams took Little Britain on the road. Their triumphant tour culminated with this amazing performance at the Blackpool ...|Tom Baker, Anthony Head, Ruth Jones, Matt Lucas|1|0|Ended
tt1059793|Garfield Gets Real|2007|Animation, Comedy, Family|Follow Garfield behind the scenes in Cartoon World where he grows bored with his life as a comic strip star.|Frank Welker, Rajia Baroudi, Gregg Berger, Jennifer Darling|1|0|Ended
tt0331175|Any Way the Wind Blows|2003|Comedy, Drama|Sort of a low-budget Short Cuts (1993), set in the Flemish port city of Antwerp on a warm day in June. Natalie, her brother Chouki, her boyfriend Walter and his ex Lara, the gallery keeper ...|Frank Vercruyssen, Diane De Belder, Eric Kloeck, Natali Broods|1|0|Ended
tt0172543|He Died with a Felafel in His Hand|2001|Comedy, Romance|A nightmare chase through hell in a never-ending, unrequited daisy chain of desire...|Noah Taylor, Emily Hamilton, Romane Bohringer, Alex Menglet|1|0|Ended
tt0325258|Dickie Roberts: Former Child Star|2003|Comedy|A thirty-something former child star hires a foster family to re-create the childhood he never had.|David Spade, Mary McCormack, Craig Bierko, Scott Terra|1|0|Ended
tt2481496|Mercy|2008|Horror, Thriller|A single mom and her two boys help take care of their grandmother with mystical powers.|Frances O Connor, Shirley Knight, Chandler Riggs, Joel Courtney|1|0|Ended
tt0914797|Bottle Shock|2008|Comedy, Drama|"The story of the early days of California wine making featuring the now infamous, blind Paris wine tasting of 1976 that has come to be known as ""Judgment of Paris""."|Chris Pine, Hal B. Klein, Alan Rickman, Jean-Michel Richaud|1|0|Ended
tt0757361|Margot at the Wedding|2007|Comedy, Drama|Margot and her son Claude decide to visit her sister Pauline after she announces that she is marrying less-than-impressive Malcolm. In short order, the storm the sisters create leaves behind a mess of thrashed relationships and exposed family secrets.|Zane Pais, Susan Blackwell, Nicole Kidman, Jack Black|1|0|Ended
tt0497323|Anamorph|2007|Crime, Horror, Thriller|A psychological thriller based on the concept of anamorphosis, a painting technique that manipulates the laws of perspective to create two competing images on a single canvas.|Willem Dafoe, Scott Speedman, Don Harvey, James Rebhorn|1|0|Ended
tt0809504|The Accidental Husband|2008|Comedy, Romance|When talk radio host Emma Lloyd advises one of her listeners to break up with her boyfriend, the jilted ex sets about getting his revenge.|Uma Thurman, Jeffrey Dean Morgan, Colin Firth, Sam Shepard|1|0|Ended
tt0498311|Re-cycle|2006|Fantasy, Horror, Mystery|After writing three best-sellers about love story based on her own experiences, the successful writer Tsui Ting-Yin is without inspiration and having difficulties to write her new novel in ...|Angelica Lee, Pou-Soi Cheang, Ekin Cheng, Lawrence Chou|1|0|Ended
tt0455093|Célibataires|2006|Comedy|N/A|Guillaume Depardieu, Olivia Bonamy, Patrick Mille, Serge Hazanavicius|1|0|Ended
tt0028628|Big City|2007|Drama|N/A|Luise Rainer, Spencer Tracy, Charley Grapewin, Janet Beecher|1|0|Ended
tt0889588|The Children of Huang Shi|2008|Drama, War|About young British journalist, George Hogg, who with the assistance of a courageous Australian nurse, saves a group of orphaned children during the Japanese occupation of China in 1937.|Jonathan Rhys Meyers, Radha Mitchell, Yun-Fat Chow, Michelle Yeoh|1|0|Ended
tt0783601|American Loser|2007|Comedy, Drama|A dramatic comedy about a self-induced attention-deficit disordered, learning disabled, Tourette s syndrome suffering, balance impaired, alcoholic young man from the Upper East Side of ...|Seann William Scott, Gretchen Mol, Deirdre O Connell, Kevin Conway|1|0|Ended
tt0488177|My Girl and I|2005|Drama, Romance|Beautiful student Su-Eun prevents her fellow student Su-Ho to drown in the ocean. Su-Ho however, does not know who saved him, until Su-Eun tells him after a while. The love between them ...|Tae-hyun Cha, Hae-suk Kim, Yun-seok Kim, Jung-Hee Moon|1|0|Ended
tt0311066|Electric Light Orchestra - Zoom Tour Live|2001|N/A|N/A|Jeff Lynne, Rosie Vela|1|0|Ended
tt0830570|I Can t Think Straight|2008|Drama, Romance|A 2008 romance film adapted from a same name novel about a London-based Jordanian of Palestinian descent, Tala, who is preparing for an elaborate wedding. A turn of events causes her to ...|Lisa Ray, Sheetal Sheth, Antonia Frering, Dalip Tahil|1|0|Ended
tt0106918|The Firm|2009|Drama, Mystery, Thriller|A young lawyer joins a prestigious law firm only to discover that it has a sinister dark side.|Tom Cruise, Jeanne Tripplehorn, Gene Hackman, Hal Holbrook|1|0|Ended
tt1290472|Dragon Hunter|2008|Action, Adventure, Fantasy|Orphaned as a baby when his parents were killed in a vicious orc attack, Kendrick of Elwood was raised by his elder brother, Darius. Though only nine at the time, Darius devoted his life to...|Erik Denton, Maclain Nelson, Slate Holmgren, Jake Suazo|1|0|Ended
tt1051231|In The Hands Of The Gods|2007|Documentary, Sport|The true story of five young British freestyle footballers  journey across the Americas to Argentina in the hope of meeting their hero, Diego Maradona.|Sami Hall Bassam, Mikey Fisher, Jeremy Lynch, Danny Robinson|1|0|Ended
tt1375309|Please Say Something|2009|Animation, Short|A troubled relationship between a Cat and Mouse set in the distant future.|N/A|1|0|Ended
tt1583321|Michael Jackson Unmasked|2009|Documentary, Biography|N/A|Janet Jackson, Michael Jackson, Quincy Jones, Andres Williams|1|0|Ended
tt1198405|Morning Light|2008|Documentary, Sport|Fifteen young sailors... six months of intense training... one chance at the brass ring. This documentary tells the story of a group of intrepid and determined young men and women, on the ...|Chris Branning, Graham Brant-Zawadzki, Chris Clark, Roy Edward Disney|1|0|Ended
tt0472522|Evanescence: Anywhere But Home|2004|Music|N/A|Terry Balsamo, William Boyd, Rocky Gray, John LeCompt|1|0|Ended
tt1092016|My Name Ain t Johnny|2008|Biography, Crime, Drama|"The true story of João Guilherme Estrella (""Johnny""), a young middle-class bon vivant who became a big-time cocaine dealer in Rio de Janeiro in the early 1990s."|Selton Mello, Giulio Lopes, Júlia Lemmertz, Felipe Severo|1|0|Ended
tt1079444|Dead Like Me: Life After Death|2009|Comedy, Drama, Fantasy|After the departure of Rube Sofer, a new head reaper named Cameron Kane takes over. He s a slick businessman who couldn t care less about helping the newly dead. Chaos ensues and brings out...|Ellen Muth, Callum Blue, Sarah Wynter, Jasmine Guy|1|0|Ended
tt1212448|Tripping the Rift: The Movie|2008|Animation, Comedy, Sci-Fi|What begins for Chode and crew as a routine mission to protect a pissed-off princess will soon become a filth- splattered saga of dismembered royalty, indestructible clown assassins and ...|Stephen Root, Maurice LaMarche, Jenny McCarthy, John Melendez|1|0|Ended
tt0935030|24 Bars|2007|Drama|Twenty four hours in the life of a prostitute and her encounters with people along the way.|Lubna Azabal, Benoît Magimel, Sami Bouajila, Bérangère Allaux|1|0|Ended
tt0475224|Belle toujours|2006|Drama, Music|38 years after the original story, Henri Husson thinks he sees Séverine one night in a concert. He follows her and makes her face her past and with sadism takes a slow and painful revenge on her.|Michel Piccoli, Bulle Ogier, Ricardo Trêpa, Leonor Baldaque|1|0|Ended
tt0469966|Rolling|2007|Drama|A med student, a teenage runaway, a lawyer, a drag queen, a high school basketball player, a drug dealer, and a teacher all cross paths in the Ecstasy-riddled L.A. underground party scene. ...|Sanoe Lake, Garrett Brawith, Rachel Hardisty, Joshua Harper|1|0|Ended
tt0814659|Anna M.|2007|Drama|In the grips of delirious illusion, Anna, a young, gentle and shy young woman convinces herself that Doctor Zanevsky is fervently in love with her. Nothing can shake her certainty... But ...|Isabelle Carré, Gaëlle Bona, Geneviève Mnich, Gilbert Melki|1|0|Ended
tt0408985|Last Holiday|2006|Comedy|Upon learning of a terminal illness, a shy woman (Queen Latifah) decides to sell off all her possessions and live it up at a posh European hotel.|Queen Latifah, LL Cool J, Timothy Hutton, Giancarlo Esposito|1|0|Ended
tt1138489|Personal Effects|2009|Drama|Walter, 24, is a wrestler, competing for a spot on the national team when he learns of his sister s brutal death. He comes home to help his mother; he works out, takes a dead-end job, and ...|Michelle Pfeiffer, Ashton Kutcher, Kathy Bates, Spencer Hudson|1|0|Ended
tt0435679|Keith|2008|Drama, Romance|Natalie has it all: yearbook editor, scholarship to college, star athlete, reigning social queen. Then Keith enters her life. Secretive and enigmatic, he slowly lures her from her comfort ...|Elisabeth Harnois, Jesse McCartney, Margo Harshman, Ignacio Serricchio|1|0|Ended
tt0988083|Killer Movie|2008|Comedy, Horror, Mystery|A reality TV director copes with a spoiled celebutante and a show gone haywire when a masked killer starts bumping off the crew in this slasher-movie satire.|Paul Wesley, Kaley Cuoco, Gloria Votsis, Torrey DeVitto|1|0|Ended
tt0305999|The Rage in Placid Lake|2003|Comedy|An exuberant, sharply satirical comedy about two parentally neglected teenagers who find the courage to believe in themselves|Jordan Brooking, Ben Lee, Rose Byrne, Miranda Richardson|1|0|Ended
tt1046173|G.I. Joe: The Rise of Cobra|2009|Action, Adventure, Sci-Fi|An elite military unit comprised of special operatives known as G.I. Joe, operating out of The Pit, takes on an evil organization led by a notorious arms dealer.|Adewale Akinnuoye-Agbaje, Christopher Eccleston, Grégory Fitoussi, Joseph Gordon-Levitt|1|0|Ended
tt0822868|Make It Happen|2008|Drama|Embarking on a journey to fulfill her dreams as a dancer, a young girl discovers a new style of dance that will prove to be the source of both conflict and self-discovery.|Mary Elizabeth Winstead, Tessa Thompson, Riley Smith, John Reardon|1|0|Ended
tt0463953|The Cutting Edge: Going for the Gold|2006|Comedy, Drama, Romance|Jackie Dorsey is the daughter of 1992 Winter Olympics Gold medalists Kate Moseley and Doug Dorsey. She grows up with ambitions of winning her own Olympic gold but that ambition seems to come to an end when she has a career threatening injury. Enter Alex Harrison as her new pairs skate partner and a new chance at Olympic Gold. But can they set aside their stubbornness long enough to actually win ...|Christy Carlson Romano, Ross Thomas, Scott Thompson Baker, Kayla Carlson|1|0|Ended
tt0283426|The Jungle Book 2|2003|Adventure, Animation, Family|Mowgli, missing the jungle and his old friends, runs away from the man village unaware of the danger he s in by going back to the wild.|John Goodman, Haley Joel Osment, Mae Whitman, Connor Funk|1|0|Ended
tt1361566|The House of Small Cubes|2008|Animation, Short, Drama|To save his house from rising flood waters, an old man uses bricks to build it higher, then he relives events from his past while searching for his dropped pipe.|N/A|1|0|Ended
tt0307873|Raaz|2002|Drama, Horror, Musical|Sanjana and Aditya decide to give their marriage one last chance. They plan a holiday in Ooty, but they don t know that a strange figure is waiting for them to come.|Dino Morea, Bipasha Basu, Malini Sharma, Shruti Ulfat|1|0|Ended
tt0415856|Hounddog|2007|Drama, Music|A drama set in the American South, where a precocious, troubled girl finds a safe haven in the music and movement of Elvis Presley.|Dakota Fanning, Granoldo Frazier, Isabelle Fuhrman, Cody Hanford|1|0|Ended
tt0343095|This Girl s Life|2004|Drama|"""Slice of life"" take on life of international porn celebrity, Moon, and her musings on modern life, love and loss."|Juliette Marquis, James Woods, Kip Pardue, Tomas Arana|1|0|Ended
tt0758743|Dirty Sanchez: The Movie|2006|Documentary, Action, Comedy|"Four guys set off on a world tour to enact the seven deadly sins. Based on the MTV Europe series ""Dirty Sanchez""."|Matthew Pritchard, Lee Dainton, Mike Locke, Dan Joyce|1|0|Ended
tt0321442|The Big Empty|2003|Comedy, Drama, Mystery|A budding actor is faced with a stalled career and a mountain of debt.|Jon Favreau, Joey Lauren Adams, Bud Cort, Jon Gries|1|0|Ended
tt0273719|Shake It|2001|Comedy, Romance, Drama|Jacob is a young man used to getting everything he wants. For several years, he has been living in a happy homosexual partnership with Jørgen, and one night Jacob decides to pop the big ...|Mads Mikkelsen, Troels Lyby, Charlotte Munck, Jesper Lohmann|1|0|Ended
tt1237916|Roskilde|2008|Documentary, Music|Documentary about one of Europe s major music festivals, the Roskilde Festival.|Gabriel Pontones|1|0|Ended
tt1010445|Rich Kids|2007|Drama|The movie is about a group of young, beautiful and most of all rich kids, who try to drown their parents neglect in booze, drugs and sex. They all live in the richest neighborhoods in ...|Simone Aagaard-Hansen, Lotte Arnsbjerg, Rune Bendixen, Frederikke Cecilie Berthelsen|1|0|Ended
tt0403360|Angels in Fast Motion|2005|Crime, Drama, Romance|The intense, realistic and unflinching tale of Maria, Allan and Steso, who are struggling for survival in urban life, about drugs.|Signe Egholm Olsen, Claus Riis Østergaard, Thure Lindhardt, Farshad Kholghi|1|0|Ended
tt1024942|Just Another Love Story|2007|Crime, Drama, Thriller|Life in the suburbs as a father of two has worn down Jonas. When a victim of a car crash mistakes him for her boyfriend Sebastian, things take a very dramatic turn as the line between truth and deception is erased.|Anders W. Berthelsen, Rebecka Hemse, Nikolaj Lie Kaas, Charlotte Fich|1|0|Ended
tt0391493|Three Dollars|2005|Drama|THREE DOLLARS is the story of Eddie, an honest, compassionate man who finds himself with a wife, a child, and three dollars. Eddie s world revolves around the three women in his life: his ...|David Wenham, Frances O Connor, Sarah Wynter, Robert Menzies|1|0|Ended
tt0340855|Monster|2008|Biography, Crime, Drama|Based on the life of Aileen Wuornos, a Daytona Beach prostitute who became a serial killer.|Charlize Theron, Christina Ricci, Bruce Dern, Lee Tergesen|1|0|Ended
tt0280490|The Hard Word|2002|Action, Comedy, Crime|"Three fraternal bank robbers languishing in jail, discover a profitable (if not dodgy) way to spend their time. Crime can most certainly pay, if you ""know wot I mean?"" However when sex and ..."|Guy Pearce, Rachel Griffiths, Robert Taylor, Joel Edgerton|1|0|Ended
tt3698408|Coming Soon|2008|Comedy|Pirated DVD seller Zafer who is formerly an extra in movies; swore to give up illegal works when his wife wanted to get divorce. To win his family back, he and his old-fashioned crew ...|Cem Yilmaz, Tülin Özen, Zafer Algöz, Özkan Ugur|1|0|Ended
tt0341555|Sex Is Zero|2002|Comedy, Romance|At Sunjong University, a few students are serious, including Eun-hyo, who works hard at aerobics in hopes of doing well in a national competition. Most students goof off: drinking, partying...|Chang Jung Lim, Ji-won Ha, Seong-guk Choi, Chae-yeong Yu|1|0|Ended
tt0914822|Tiësto in Concert 2|2004|Documentary, Music|Footage from Tiësto s concerts at the Gelredome in Arnhem, Holland on October 29/30, 2004.|Matt Hales, DJ Mason, Tiësto|1|0|Ended
tt1268208|Gnaw|2008|Comedy, Horror|A group of people staying in England discover that there are brutal cannibals in their midst.|Sara Dylan, Rachel Mitchem, Oliver Squires, Nigel Croft-Adams|1|0|Ended
tt1350498|Mega Shark vs Giant Octopus|2009|Horror, Sci-Fi|The California coast is terrorized by two enormous prehistoric sea creatures as they battle each other for supremacy of the sea.|Deborah Gibson, Lorenzo Lamas, Vic Chao, Jonathan Nation|1|0|Ended
tt0355857|Onmyoji: The Yin Yang Master|2001|Action, Fantasy, Drama|N/A|Mansai Nomura, Hideaki Itô, Eriko Imai, Yui Natsukawa|1|0|Ended
