tt1370334|Boys Over Flowers|2009|Comedy, Drama, Romance|Poor girl attends the elite Shin Hwa High and is bullied by the leader of F4 (the four richest boys). He becomes attracted to her; however, she has a crush on his best friend. Whom will she choose?|Hye-sun Koo, Min-ho Lee, Hyun-joong Kim, Bum Kim|1|0|Ended
tt1150945|Kathy Griffin: Straight to Hell|2007|Documentary, Comedy|"Kathy Griffin talks about her Emmy acceptance speech, Larry Craig, Paris Hilton,  Paula Abdul , and _""View, The"" (1997)_."|Kathy Griffin|1|0|Ended
tt2851314|Piégé|2014|Thriller|N/A|Pascal Elbé, Laurent Lucas, Caroline Bal, Arnaud Henriet|1|0|Ended
tt0295281|Girafot|2001|Action, Drama|N/A|Meital Dohan, Liat Glick, Tinkerbell, Micha Celektar|1|0|Ended
tt5921218|The Mistletoe Promise|2016|Romance|N/A|Jaime King, Luke Macfarlane, Lochlyn Munro, Sarah Smyth|1|0|Ended
tt4425258|My Country, My Country|2006|Documentary|N/A|N/A|1|0|Ended
tt1064728|Candy Boy|2007|Animation, Short|Panic in the orphanage! The children are mysteriously falling ill and Candy Boy, the most valiant of the orphans, investigates. But the arrival of a new boarder complicates our hero s inquiries.|Marie-Christine Darah, Julien Bouanich, Chloé Berthier, Aymen Saïdi|1|0|Ended
tt0405296|A Scanner Darkly|2006|Animation, Drama, Mystery|An undercover cop in a not-too-distant future becomes involved with a dangerous new drug and begins to lose his own identity as a result.|Rory Cochrane, Robert Downey Jr., Mitch Baker, Keanu Reeves|1|0|Ended
tt4261922|Shem|2006|Documentary, History|Memory can be a tricky thing. In this moving documentary we learn about an historical event that is remembered differently by its various participants. A 1946 shipwrecked boat with Jewish ...|N/A|1|0|Ended
tt0906734|The Broken|2008|Drama, Horror, Thriller|In London, the radiologist Gina McVey organizes a surprise birthday party to her father John McVey with her boyfriend Stefan Chambers, her brother Daniel McVey and his girlfriend Kate ...|Lena Headey, Ulrich Thomsen, Melvil Poupaud, Michelle Duncan|1|0|Ended
tt0319531|I ll Sleep When I m Dead|2003|Crime, Drama, Mystery|Will Graham is a gangster who has left the life of crime and is living in the countryside. He comes out of hiding to investigate the death of his brother when he learns that he committed ...|Clive Owen, Charlotte Rampling, Jonathan Rhys Meyers, Malcolm McDowell|1|0|Ended
tt0304312|Cows Knocked Up by Fog|2002|Comedy|N/A|Abel Vom Acker, Sven Hoffmann, Manfred Keil, Heinz Kreitzen|1|0|Ended
tt0377800|Don t Come Knocking|2005|Drama, Music|Howard Spence (Sam Shepard) has seen better days. Once a big Western movie star, he now drowns his disgust for his selfish and failed life with alcohol, drugs and young women. If he were to...|James Roday, Jeffrey Vincent Parise, Majandra Delfino, Marieh Delfino|1|0|Ended
tt0246659|A Goddamn Job|2001|Comedy, Fantasy|N/A|Oliver Korittke, Heike Makatsch, Thierry van Werveke, Anna Loos|1|0|Ended
tt0356680|The Family Stone|2005|Comedy, Drama, Romance|An uptight, conservative businesswoman accompanies her boyfriend to his eccentric and outgoing family s annual Christmas celebration and finds that she s a fish out of water in their free-spirited way of life.|Claire Danes, Diane Keaton, Rachel McAdams, Dermot Mulroney|1|0|Ended
tt1477652|Tristan & Isolde|2006|Comedy, Fantasy, Romance|A surreal journey, Tristan & Fall drink a magic potion to fall in love, it creates no end of complications.|Jennifer Betit Yen, Robert Smith, Jonathan C. Green, Elizabeta Vardic|1|0|Ended
tt0912593|No End in Sight|2007|Documentary, War|N/A|Campbell Scott, Gerald Burke, Ali Fadhil, Omar Fekeiki|1|0|Ended
tt0411427|One Day in Europe|2005|Comedy|The day of the Champions League final between Galatasaray and Deportivo la Coruña stops life in four European cities, adding to the problems of tourists in trouble, who are already struggling with the language barrier.|Megan Gay, Lyudmila Tsvetkova, Andrey Sokolov, Oleg Assadulin|1|0|Ended
tt0411477|Hellboy II: The Golden Army|2008|Action, Adventure, Fantasy|The mythical world starts a rebellion against humanity in order to rule the Earth, so Hellboy and his team must save the world from the rebellious creatures.|Ron Perlman, Selma Blair, Doug Jones, John Alexander|1|0|Ended
tt0362524|Crazy Race|2003|Action, Comedy, Romance|An illegal street race across Germany - and the main character must win to give back money to mafia boss.|Ludger Pistor, Gennadi Vengerov, Thierry van Werveke, Christian Tramitz|1|0|Ended
tt1094246|Frei:Gespielt - Mehmet Scholl - Über das Spiel hinaus|2007|Documentary, Sport|N/A|Mehmet Scholl|1|0|Ended
tt0418647|Dreamer: Inspired By a True Story|2005|Drama, Family, Sport|Cale Crane catalyzes the rescue and rehabilitation of Sonador, a race horse with a broken leg.|Kurt Russell, Dakota Fanning, Kris Kristofferson, Elisabeth Shue|1|0|Ended
tt0898323|Leroy|2007|Comedy, Drama, Romance|Leroy (16) is an Afro-German boy who, not only notoriously unlucky, must also battle with an identity crisis born of the fact that he is both a highly cultured, well-mannered German AND ...|Alain Morel, Anna Hausburg, Constantin von Jascheroff, Günther Kaufmann|1|0|Ended
tt0762107|I Now Pronounce You Chuck & Larry|2007|Comedy, Romance|Two straight, single Brooklyn firefighters pretend to be a gay couple in order to receive domestic partner benefits.|Adam Sandler, Kevin James, Jessica Biel, Dan Aykroyd|1|0|Ended
tt0373788|Le Dernier Tunnel|2004|Crime, Drama|Based on a true story: a recently released convict dreams of one last heist with his old gang before retiring. Posing as electrical workers, they dig a tunnel deep under a bank vault. ...|Michel Côté, Jean Lapointe, Christopher Heyerdahl, Nicolas Canuel|1|0|Ended
tt0378715|Snowland|2005|Drama, Romance|In the snowy landscape of Lapland, a newly-widowed writer discovers the traces of a bygone love story through which she finds a way back to her own life.|Thomas Kretschmann, Julia Jentsch, Maria Schrader, Ulrich Mühe|1|0|Ended
tt0489325|V2: Dead Angel|2007|Action, Mystery, Thriller|The tough Detective Vares, get hired by a friend accused of murdering a girl. His job is to find the real killer, but people aren t talking. Before he can get traction another homicide takes place- and things move toward a dire conclusion.|Juha Veijonen, Hannu-Pekka Björkman, Jussi Lampi, Johanna Kokko|1|0|Ended
tt1653007|Going with the Flow|2010|Adventure, Comedy|An uninspiring film about three men on a quest to find their inner.. tubes.|Adam Loewen, Dustin Mennie, Thilo Savage, Spencer Buffum|1|0|Ended
tt1376247|Space Girls in Beverly Hills|2009|Sci-Fi|Three vibrantly retro space girls from the planet Vanisia must try to fit in as normal Beverly Hills women when they suddenly make a crash landing in the backyard of wealthy infamous ...|Christi Adams, Trudy Adams, Elaine Bacall, Ginarae Badagliacco|1|0|Ended
tt0473188|The Death and Life of Bobby Z|2007|Action, Crime, Thriller|A DEA agent provides former Marine Tim Kearney with a way out of his prison sentence: impersonate Bobby Z, a recently deceased drug dealer, in a hostage switch with a crime lord.|Paul Walker, Laurence Fishburne, Olivia Wilde, Jason Flemyng|1|0|Ended
tt0293815|Friday After Next|2002|Comedy, Drama|Craig and Day Day have finally moved out of their parents houses and into their own crib. The cousins work nights at a local mall as security guards. When their house is robbed on Christmas...|Ice Cube, Mike Epps, John Witherspoon, Don  D.C.  Curry|1|0|Ended
tt0499556|War|2007|Action, Crime, Thriller|"An FBI Agent seeks vengeance on a mysterious assassin known as ""Rogue"" who murdered his partner."|Jet Li, Jason Statham, John Lone, Devon Aoki|1|0|Ended
tt0475289|Hack!|2007|Comedy, Horror|Wanting to raise their grades, a handful of college kids are randomly selected for a field trip to study wildlife, but don t get the chance as cliché horror film-style murders occur.|Kane Hodder, Jay Kenneth Johnson, Travis Schuldt, Gabrielle Richens|1|0|Ended
tt0330509|Kannibal|2001|Horror|A rival mobster and the police enter the weird world of a beautiful female mob boss in order to do battle with her and bring her organization down.|Richard Driscoll, Linnea Quigley, Lucien Morgan, Vass Anderson|1|0|Ended
tt0985050|Darkness Surrounds Roberta|2008|Horror, Mystery, Thriller|Deciet, perversion, and an unseen murderer follow a wealthy socialite through Italy as her mind breaks down into madness.|Yassmin Pucci, Fabrizio Croci, Leandro Guerrini, Raine Brown|1|0|Ended
tt1067106|A Christmas Carol|2004|Animation, Drama, Family|An animated retelling of Charles Dickens  classic novel about a Victorian-era miser taken on a journey of self-redemption, courtesy of several mysterious Christmas apparitions.|Jim Carrey, Steve Valentine, Daryl Sabara, Sage Ryan|1|0|Ended
tt0390649|Uniform|2003|N/A|Economic unrest roils central China s Shaanxi Province: local factories are merging, thugs threaten managers, personnel records get lost, and workers are without protections such as health ...|Kai Han, Hongli Liang, Hua Qin, Xueqiong Zeng|1|0|Ended
tt1331307|Dread|2009|Drama, Horror, Thriller|Three college students set out to document what other people dread most.|Jackson Rathbone, Hanne Steen, Laura Donnelly, Jonathan Readwin|1|0|Ended
tt0417658|Factotum|2005|Comedy, Drama, Romance|"This drama centers on Hank Chinaski, the fictional alter-ego of ""Factotum"" author Charles Bukowski, who wanders around Los Angeles, CA trying to live off jobs which don t interfere with his primary interest, which is writing. Along the way, he fends off the distractions offered by women, drinking and gambling."|Matt Dillon, Lili Taylor, Didier Flamand, Fisher Stevens|1|0|Ended
tt0410097|Hustle & Flow|2005|Crime, Drama, Music|With help from his friends, a Memphis pimp in a mid-life crisis attempts to become a successful hip-hop emcee.|Terrence Howard, Anthony Anderson, Taryn Manning, Taraji P. Henson|1|0|Ended
tt0132245|Driven|2001|Action, Drama, Sport|A young hot shot driver is in the middle of a championship season and is coming apart at the seams. A former CART champion is called in to give him guidance.|Sylvester Stallone, Burt Reynolds, Kip Pardue, Stacy Edwards|1|0|Ended
tt0452608|Death Race|2008|Action, Sci-Fi, Thriller|Ex-con Jensen Ames is forced by the warden of a notorious prison to compete in our post-industrial world s most popular sport: a car race in which inmates must brutalize and kill one another on the road to victory.|Jason Statham, Joan Allen, Ian McShane, Tyrese Gibson|1|0|Ended
tt0410377|Nim s Island|2008|Adventure, Comedy, Family|A young girl inhabits an isolated island with her scientist father and communicates with a reclusive author of the novel she s reading.|Abigail Breslin, Jodie Foster, Gerard Butler, Michael Carman|1|0|Ended
tt0157583|Enigma|2001|Drama, Mystery, Romance|A young genius frantically races against time to crack an enemy code and solve the mystery surrounding the woman he loves.|Dougray Scott, Kate Winslet, Saffron Burrows, Jeremy Northam|1|0|Ended
tt0458525|X-Men Origins: Wolverine|2009|Action, Adventure, Sci-Fi|A look at Wolverine s early life, in particular his time with the government squad Team X and the impact it will have on his later years.|Hugh Jackman, Liev Schreiber, Danny Huston, Will.i.am|1|0|Ended
tt0077651|Halloween|2007|Horror, Thriller|On Halloween night of 1963, six-year-old Michael Myers stabbed his sister to death. After sitting in a mental hospital for 15 years, Myers escapes and returns to Haddonfield to kill.|Donald Pleasence, Jamie Lee Curtis, Nancy Kyes, P.J. Soles|1|0|Ended
tt0188453|Birthday Girl|2001|Comedy, Crime, Thriller|A thirtysomething bank clerk from St Albans has his small-town life exploded by the arrival of his Russian mail-order bride.|Nicole Kidman, Ben Chaplin, Vincent Cassel, Mathieu Kassovitz|1|0|Ended
tt0398375|Rumor Has It...|2005|Comedy, Drama, Romance|"Sarah Huttinger is a woman who learns that her family was the inspiration for the book and film ""The Graduate"" -- and that she just might be the offspring of the well-documented event."|Jennifer Aniston, Kevin Costner, Shirley MacLaine, Mark Ruffalo|1|0|Ended
tt0272020|The Last Castle|2001|Action, Drama, Thriller|A court-martialed general rallies together 1200 inmates to rise against the corrupt system that put him away.|Robert Redford, James Gandolfini, Mark Ruffalo, Steve Burton|1|0|Ended
tt1292569|A Muppets Christmas: Letters to Santa|2008|Comedy, Family, Music|When Gonzo accidentally diverts three letters to Santa, he talks Kermit and his friends into delivering them to the North Pole personally.|Steve Whitmire, Dave Goelz, Bill Barretta, Eric Jacobson|1|0|Ended
tt0839967|The Rest Is Silence|2007|Comedy, Drama|"In 1911-12, the Romanian movie director Grigore Brezianu and the financial tycoon Leon Popescu made together the 2 hours long movie ""Romania s Independence"" - an as faithful as possible ..."|Marius Florea Vizante, Ovidiu Niculescu, Mirela Zeta, Sandu Mihai Gruia|1|0|Ended
tt0446752|Full of It|2007|Drama, Comedy|A young kid is forced to live out the lies he told to become popular.|Ryan Pinkston, Kate Mara, Teri Polo, Craig Kilborn|1|0|Ended
tt0439884|A World Without Thieves|2004|Action, Crime, Drama|A con-team couple (Andy Lau & Rene Liu) head west after taking a city businessman for his BMW. But an encounter with a naive young carpenter travelling home with his life savings challenges their fate as thieves.|Andy Lau, Rene Liu, You Ge, Baoqiang Wang|1|0|Ended
tt1219703|Nossa Vida Não Cabe Num Opala|2008|Drama|N/A|Jonas Bloch, Milhem Cortaz, Dercy Gonçalves, Maria Manoella|1|0|Ended
tt0910827|7 More Days In The Tank|2006|Comedy|"A gifted stand-up comedian and talented U.S. Paralympic soccer player, Josh Blue refuses to bow to any of the challenges that come from living with cerebral palsy. He jokes, ""I realize that..."|Josh Blue|1|0|Ended
tt0247164|American Nightmare|2002|Crime, Horror, Thriller|A deranged female serial killer stalks seven young people whom phone a radio call-in show to discuss their darkest fears and a night-long game of cat-and-mouse is put into motion by the darkly sinister-looking murderess.|Debbie Rochon, Brandy Little, Johnny Sneed, Chris Ryan|1|0|Ended
tt0452592|Borderland|2007|Crime, Horror, Thriller|On a trip to a Mexican border town, three college friends stumble upon a human-sacrifice cult.|Brian Presley, Rider Strong, Jake Muxworthy, Beto Cuevas|1|0|Ended
tt0783238|The Dead Girl|2006|Crime, Drama, Mystery|The clues to a young woman s death come together as the lives of seemingly unrelated people begin to intersect.|Toni Collette, Piper Laurie, Donnie Smith, Michael Raysses|1|0|Ended
tt0977669|The Vanguard|2008|Action, Horror, Sci-Fi|The year is 2015 and overpopulation and famine have plunged our planet into chaos and one desperate survivor finds himself being hunted and pursued by hordes of rage-crazed zombies.|Karen Admiraal, Jack Bailey, Terry Cole, Che Conroy|1|0|Ended
tt1054115|Manhunt|2008|Horror|The summer of 1974, four young people are all ambushed and left unconscious. They wake up deep in the woods with no one around but the sound of a hunting horn.|Henriette Bruusgaard, Jørn Bjørn Fuller Gee, Lasse Valdal, Nini Bull Robsahm|1|0|Ended
tt0964185|Tetro|2009|Drama|Bennie travels to Buenos Aires to find his long-missing older brother, a once-promising writer who is now a remnant of his former self. Bennie s discovery of his brother s near-finished play might hold the answer to understanding their shared past and renewing their bond.|Vincent Gallo, Alden Ehrenreich, Maribel Verdú, Silvia Pérez|1|0|Ended
tt0827782|Return to House on Haunted Hill|2007|Horror|N/A|Amanda Righetti, Cerina Vincent, Erik Palladino, Tom Riley|1|0|Ended
tt0447448|The Slaughterhouse Massacre|2005|Horror|N/A|Stephani Wells, Cory Nelson, Paul Gagné, Shaila Vaidya|1|0|Ended
tt0448123|Sleepover Nightmare|2005|Horror|A couple of friends party wildly at a vacation house. While they re drinking and having the time of their lives, an escaped mental patient stalks the party, killing anyone who parts from ...|Hayley Sales, Chad Rook, Kristine Cofsky, Richard Olak|1|0|Ended
tt0486028|Thr3e|2006|Drama, Horror, Mystery|Innocent lives hang on the whim of an elusive psychopathic murderer whose strange riddles and impossible timelines force three people into a mission to end the game before one or all of them die.|Marc Blucas, Justine Waddell, Laura Jordan, Max Ryan|1|0|Ended
tt0259102|Wambo|2001|Biography, Drama|Feature Film about the life and death of the famous Bavarian actor Walter Sedlmayr.|Jürgen Tarrach, Ruth Drexel, Bettina Redlich, Alexander Lutz|1|0|Ended
tt0889139|Why Men Don t Listen and Women Can t Read Maps|2007|Comedy, Romance|The life of a young couple.|Benno Fürmann, Jessica Schwarz, Matthias Matschke, Annika Kuhl|1|0|Ended
tt0455782|The Hunting Party|2007|Adventure, Comedy, Drama|A young journalist, a seasoned cameraman and a discredited war correspondent embark on an unauthorized mission to find the No.1 war criminal in Bosnia. However, their extremely dangerous target decides to come after them.|Terrence Howard, Richard Gere, Gordana Vukres, James Brolin|1|0|Ended
tt0961750|Berlin am Meer|2007|Drama, Romance|They are students - at least that s what their parents think - they are the disc-jockeys in the in-clubs in town, they party with no end, they fall in love, they have the best summer in their life in the coolest city of the world: Berlin.|Robert Stadlober, Anna Brüggemann, Axel Schreiber, Jana Pallaske|1|0|Ended
tt0486583|Fred Claus|2007|Comedy, Family, Fantasy|Fred Claus, Santa s bitter older brother, is forced to move to the North Pole.|Vince Vaughn, Paul Giamatti, John Michael Higgins, Miranda Richardson|1|0|Ended
tt0308353|Happily N Ever After|2006|Animation, Adventure, Comedy|An alliance of evil-doers, led by Frieda, looks to take over Fairy Tale Land. But when Ella realizes her stepmother is out to ruin her storybook existence, she takes a dramatic turn and blossoms into the leader of the resistance effort.|George Carlin, John DiMaggio, Andy Dick, Sarah Michelle Gellar|1|0|Ended
tt0338427|Shopgirl|2005|Drama, Romance|A film adaptation of Steve Martin s novel about a complex love triangle between a bored salesgirl, a wealthy businessman and an aimless young man.|Steve Martin, Claire Danes, Jason Schwartzman, Bridgette Wilson-Sampras|1|0|Ended
tt0469754|The Boss of It All|2006|Comedy|An IT company hires an actor to serve as the company s president in order to help the business get sold to a cranky Icelander.|Jens Albinus, Peter Gantzler, Friðrik Þór Friðriksson, Benedikt Erlingsson|1|0|Ended
tt0430097|The Fisherman and His Wife|2005|Comedy, Drama, Romance|Otto (Ulmen) and his friend Leo (Verhoeven) are German veterinarians, travelling Japan looking for Fish to buy and sell...|Alexandra Maria Lara, Christian Ulmen, Simon Verhoeven, Zoe Hüttenhain|1|0|Ended
tt0373469|Kiss Kiss Bang Bang|2005|Comedy, Crime, Mystery|A murder mystery brings together a private eye, a struggling actress, and a thief masquerading as an actor.|Robert Downey Jr., Val Kilmer, Michelle Monaghan, Corbin Bernsen|1|0|Ended
tt0180846|Monsoon|2001|Drama, Romance|N/A|Richard Tyson, Helen Brodie, Doug Jeffery, Jenny McShane|1|0|Ended
tt5744884|Vampires vs. Zombies|2004|Comedy|N/A|Van Brockmann|1|0|Ended
tt0465455|Exterminator City|2005|Comedy, Horror, Sci-Fi|The Year is 2027. A robot pest controller turned serial killer has embarked on a murderous rampage, carving his way through the population of Atro City. Following in the wake of his ...|Julie Strain, Brinke Stevens, Teresa May, Cathy Barry|1|0|Ended
tt2582590|Vicious|2003|Comedy|Freddie and Stuart are an old gay couple who have been together for nearly 50 years. Their lives now revolve around entertaining their frequent guests and hurling insults at each other at every opportunity.|Derek Jacobi, Ian McKellen, Frances de la Tour, Iwan Rheon|1|0|Ended
tt0329954|Thirteen Erotic Ghosts|2002|Fantasy|Paranormal investigators arrive at a burned-down girlschool to check if the rumors of ghost appearances are true. With their special goggles they see that the ghosts are constantly engaging in lesbian sex which gets everyone horny.|Julie Strain, Richard Gabai, John Henry Richardson, Peter Spellos|1|0|Ended
tt0301661|Corpses Are Forever|2003|Action, Comedy, Crime|The Gates of Hell have blown open and it is up to an amnesiac spy and a rag-tag bunch of soldiers to find out how to close it.|Richard Lynch, Jose Prendes, Brinke Stevens, Bill Perlach|1|0|Ended
tt0875630|Wedding Slashers|2006|Horror|Jenna is a young woman that has lost every man she loved since she was very young. Now she has encountered Alex and they decide to move in together and get married. She has told him that ...|Barry Adams, Shenoah Allen, Monica Ault, Mark Chavez|1|0|Ended
tt1235142|Last Ride|2009|Drama|A young boy travels across Australia with his father, who s wanted by the law for committing a violent crime.|Hugo Weaving, Tom Russell, Anita Hegh, John Brumpton|1|0|Ended
tt0430684|Tomb of the Werewolf|2004|Horror|Pre-credit opening sequence consists of Countess Erzabeth Bathory, making a pact with the devil in exchange for eternal youth & beauty from sacrificing young, nubile virgin women. After ...|Paul Naschy, Jay Richardson, Michelle Bauer, Stephanie Bentley|1|0|Ended
tt4354312|Megaconda|2010|Horror, Sci-Fi|Volcanic activity awakens a prehistoric giant anaconda, forcing the local Sheriff and a band of volunteers to stop the menace.|Michelle Bauer, Matthew Chandler, Peter Dang, Ben Deschaine|1|0|Ended
tt1334569|Voodoo Dollz|2008|Comedy|Christina is sent to the Lovecraft School for Girls as punishment for being caught having sex with Meg in a locker room. She finds that she fits in very well.|Christine Nguyen, Beverly Lynne, Monique Parent, Charlie Laine|1|0|Ended
tt0400439|Fort Doom|2004|Action, Comedy, Horror|N/A|Billy Drago, Joshua Park, Jennifer Lauren Grant, Debbie Rochon|1|0|Ended
tt0446299|Clarkson s Top 100 Cars|2001|Documentary|N/A|Jeremy Clarkson, Claire Millin, Lorett Pearce-Jones, Sam Jordan|1|0|Ended
tt0462516|Satan Hates You|2009|Horror|Inspired from the golden age of religious cinema, Satan Hates You is a graphic horror film that tells the stories of a brother and sister and their personal struggles with the ultimate evil: Lucifer himself!|Don Wood, Christine Spencer, Angus Scrimm, Reggie Bannister|1|0|Ended
tt0379865|Leatherheads|2008|Comedy, Drama, Romance|In 1925, an enterprising pro football player convinces America s too-good-to-be-true college football hero to play for his team and keep the league from going under.|John Krasinski, David de Vries, Rick Forrester, Craig S. Harper|1|0|Ended
tt0799934|Be Kind Rewind|2008|Comedy|Two bumbling store clerks inadvertently erase the footage from all of the tapes in their video rental store. In order to keep the business running, they re-shoot every film in the store with their own camera, with a budget of zero dollars.|Jack Black, Yasiin Bey, Danny Glover, Mia Farrow|1|0|Ended
tt0463985|The Fast and the Furious: Tokyo Drift|2006|Action, Crime, Thriller|A teenager becomes a major competitor in the world of drift racing after moving in with his father in Tokyo to avoid a jail sentence in America.|Lucas Black, Damien Marzette, Trula M. Marcus, Zachery Ty Bryan|1|0|Ended
tt0304711|The Order|2003|Action, Mystery, Thriller|A young priest is sent to Rome to investigate the troubling death of the head of his order.|Heath Ledger, Shannyn Sossamon, Benno Fürmann, Mark Addy|1|0|Ended
tt0349205|Cheaper by the Dozen|2003|Comedy, Family|With his wife doing a book tour, a father of twelve must handle a new job and his unstable brood.|Steve Martin, Bonnie Hunt, Piper Perabo, Tom Welling|1|0|Ended
tt0274812|Secretary|2002|Comedy, Drama, Romance|A young woman, recently released from a mental hospital, gets a job as a secretary to a demanding lawyer, where their employer-employee relationship turns into a sexual, sadomasochistic one.|James Spader, Maggie Gyllenhaal, Jeremy Davies, Lesley Ann Warren|1|0|Ended
tt1092002|Kiss of Life|2003|Comedy, Romance|Before his marriage in Milos an Aegean island, 30-year old Paschalis ends up accidentally in Sifnos, where he meets a mysterious photographer.Will he finally reach the church? And what is ...|Laertis Malkotsis, Katerina Papoutsaki, Zeta Douka, Themos Anastasiadis|1|0|Ended
tt1087835|Email to Bill Gates|2007|Drama|Young German boy whose father tells him that Microsoft billionaire Bill Gates can solve anything. His father dies and the little boy makes a trip to Seattle with his grandfather to find Bill Gates.|Katharina Böhm, Jörg Schüttauf, Joel Eisenblätter, Dominique Chiout|1|0|Ended
tt0401248|Beautiful Boxer|2004|Action, Drama, Sport|Bio-pic of transgender Muay Thai boxer Parinya Charoenphol who pursued the sport to pay for her sex change operation.|Asanee Suwan, Sorapong Chatree, Orn-Anong Panyawong, Nukkid Boonthong|1|0|Ended
tt0386387|Contergan|2007|Documentary|N/A|N/A|1|0|Ended
tt1094249|Hotel Chevalier|2007|Short, Drama, Romance|A prologue of one heart-breaking history of love and the prologue of the travel told in The Darjeeling Limited (2007).|Jason Schwartzman, Natalie Portman, Waris Ahluwalia, Michel Castejon|1|0|Ended
tt0376105|Racing Stripes|2005|Adventure, Comedy, Drama|An abandoned zebra grows up believing he is a racehorse, and, with the help of his barnyard friends and a teenage girl, sets out to achieve his dream of racing with thoroughbreds.|Bruce Greenwood, Hayden Panettiere, Caspar Poyck, Gary Bullock|1|0|Ended
tt0120824|The Shipping News|2001|Drama|An emotionally-beaten man with his young daughter moves to his ancestral home in Newfoundland to reclaim his life.|Kevin Spacey, Julianne Moore, Judi Dench, Cate Blanchett|1|0|Ended
